bic_8,bic,bank
AAOOCA82,AAOOCA82XXX,CASSIOPAY LIMITED
ABFOCA82,ABFOCA82XXX,ABFPAY.COM LTD
ACCTCA61,ACCTCA61XXX,ACUMEN CAPITAL FINANCE PARTNERS LIMITED
ACKFCAT1,ACKFCAT1XXX,ACKER FINLEY INC.
ACMCCAT1,ACMCCAT1XXX,A.C. MACPHERSON AND CO. INC.
ACMTCAMM,ACMTCAMMXXX,AIR CANADA PENSION MASTER TRUST FUND
AFMICATT,AFMICATTXXX,INVESCO CANADA LTD
AFTECA62,AFTECA62XXX,AFRICHANGE TECHNOLOGIES LIMITED
AIMCCA61,AIMCCA61XXX,ALBERTA INVESTMENT MANAGEMENT CORPORATION
AIMCCA66,AIMCCA66XXX,ALBERTA INVESTMENT MANAGEMENT CORPORATION
AIMCCA6K,AIMCCA6KXXX,ALBERTA INVESTMENT MANAGEMENT CORPORATION
AIMCCA6L,AIMCCA6LXXX,ALBERTA INVESTMENT MANAGEMENT CORPORATION
AIVVCATT,AIVVCATTXXX,AGF INVESTMENTS INC.
ALPICAM1,ALPICAM1XXX,ALPHAFIXE CAPITAL
ALTTCA61,ALTTCA61XXX,ATB CAPITAL MARKETS
APCTCA62,APCTCA62XXX,APA CANADA TECH LIMITED
APTECA22,APTECA22XXX,APUS TECHNOLOGY INC.
ARDUCA82,ARDUCA82XXX,ARDUA SOLUTIONS CORP
ARYYCA82,ARYYCA82XXX,LANSDOWNE PAYMENTS LTD.
ASGGCAT1,ASGGCAT1XXX,TD ASSET MANAGEMENT INC.
ASILCAT1,ASILCAT1XXX,ASCENDANTFX CAPITAL INC
ASILCATT,ASILCATTXXX,ASCENDANTFX CAPITAL INC
ATBRCA6E,ATBRCA6EXXX,ATB FINANCIAL
ATLFCA82,ATLFCA82XXX,ATLASPAY FINANCE LTD
ATRFCA61,ATRFCA61XXX,ALBERTA TEACHERS RETIREMENT FUND BOARD
BAFDCAM1,BAFDCAM1XXX,BANQUE DE DEVELOPPEMENT DU CANADA
BAGNCAT1,BAGNCAT1XXX,BLACKROCK ASSET MANAGEMENT CANADA LIMITED
BAMSCAT1,BAMSCAT1XXX,BANK OF MONTREAL SHORCAN
BAYYCA82,BAYYCA82XXX,BANCORAGE PAY CORP.
BCANCAW2,BCANCAW2XXX,BANK OF CANADA
BCNGCAT1,BCNGCAT1XXX,BLACK CREEK INVESTMENT MANAGEMENT INC.
BCOMCAT1,BCOMCAT1XXX,BCPBANK
BCVMCA81,BCVMCA81XXX,BRITISH COLUMBIA INVESTMENT MANAGEMENT CORPORATION
BCVMCA8G,BCVMCA8GXXX,BRITISH COLUMBIA INVESTMENT MANAGEMENT CORPORATION
BCVMCA8V,BCVMCA8VXXX,BRITISH COLUMBIA INVESTMENT MANAGEMENT CORPORATION
BCVPCA82,BCVPCA82XXX,BCV PAY LIMITED
BEAOCA91,BEAOCA91XXX,BEACON SECURITIES LTD.
BFRLCAT1,BFRLCAT1XXX,BURNS FRY LIMITED
BFXCCAT2,BFXCCAT2XXX,BENDIX FOREIGN EXCHANGE CORPORATION
BGCOCATT,BGCOCATTXXX,"BEUTEL, GOODMAN AND COMPANY LTD."
BHIMCAT1,BHIMCAT1XXX,BMO PRIVATE INVESTMENT COUNSEL INC
BHLLCA81,BHLLCA81XXX,CANACCORD GENUITY CORP
BKCHCA21,BKCHCA21XXX,BANK OF CHINA TORONTO BRANCH
BKCHCAT2,BKCHCAT2XXX,BANK OF CHINA TORONTO BRANCH
BKCHCATT,BKCHCATTVAN,BANK OF CHINA (CANADA)
BKCHCATT,BKCHCATTXXX,BANK OF CHINA (CANADA)
BLCMCAMM,BLCMCAMMXXX,LAURENTIAN BANK OF CANADA
BLCSCAM1,BLCSCAM1XXX,LAURENTIAN BANK SECURITIES INC.
BMCCCAT1,BMCCCAT1XXX,BARCLAYS MCCONNELL LTD
BNBNCAT2,BNBNCAT2XXX,BNB TRANSFER CORP
BNDCCAMM,BNDCCAMMCUS,BANQUE NATIONALE DU CANADA
BNDCCAMM,BNDCCAMMIMM,BANQUE NATIONALE DU CANADA
BNDCCAMM,BNDCCAMMINT,BANQUE NATIONALE DU CANADA
BNDCCAMM,BNDCCAMMNBF,BANQUE NATIONALE DU CANADA
BNDCCAMM,BNDCCAMMPDM,BANQUE NATIONALE DU CANADA
BNDCCAMM,BNDCCAMMVAL,BANQUE NATIONALE DU CANADA
BNDCCAMM,BNDCCAMMXXX,BANQUE NATIONALE DU CANADA
BNPACAMM,BNPACAMMSUB,BNP PARIBAS
BNPACAMM,BNPACAMMTTT,BNP PARIBAS
BNPACAMM,BNPACAMMVVV,BNP PARIBAS
BNPACAMM,BNPACAMMXXX,BNP PARIBAS
BNPVCAM1,BNPVCAM1XXX,BNP PARIBAS (CANADA) SECURITIES INC
BOFACATT,BOFACATTCAD,"BANK OF AMERICA, N.A.,CANADA BRANCH"
BOFACATT,BOFACATTFCS,"BANK OF AMERICA, N.A.,CANADA BRANCH"
BOFACATT,BOFACATTGRC,"BANK OF AMERICA, N.A.,CANADA BRANCH"
BOFACATT,BOFACATTTSY,"BANK OF AMERICA, N.A.,CANADA BRANCH"
BOFACATT,BOFACATTVAN,"BANK OF AMERICA, N.A.,CANADA BRANCH"
BOFACATT,BOFACATTXXX,"BANK OF AMERICA, N.A.,CANADA BRANCH"
BOFMCAM2,BOFMCAM2CUS,BANK OF MONTREAL
BOFMCAM2,BOFMCAM2GPF,BANK OF MONTREAL
BOFMCAM2,BOFMCAM2NBB,BANK OF MONTREAL
BOFMCAM2,BOFMCAM2NBW,BANK OF MONTREAL
BOFMCAM2,BOFMCAM2XXX,BANK OF MONTREAL
BOFMCAM3,BOFMCAM3XXX,BANK OF MONTREAL
BOFMCAT2,BOFMCAT2BMO,BANK OF MONTREAL
BOFMCAT2,BOFMCAT2CLS,BANK OF MONTREAL
BOFMCAT2,BOFMCAT2CUS,BANK OF MONTREAL
BOFMCAT2,BOFMCAT2FXM,BANK OF MONTREAL
BOFMCAT2,BOFMCAT2GCT,BANK OF MONTREAL
BOFMCAT2,BOFMCAT2XXX,BANK OF MONTREAL
BOTKCATX,BOTKCATXXXX,"MUFG BANK, LTD., CANADA BRANCH"
BOXSCA82,BOXSCA82XXX,BOXPAY SERVICES INC.
BRCOCAMM,BRCOCAMMXXX,PGM GLOBAL INC.
BRIKCAT2,BRIKCAT2XXX,BREINROCK LIMITED
BRPDCAT1,BRPDCAT1XXX,BRIGHTWAY CAPITAL (CANADA) LTD.
BRWLCAT1,BRWLCAT1XXX,INTEGRAL WEALTH SECURITIES LIMITED
BSCDCAT1,BSCDCAT1XXX,"BSPI CANADA, L.P."
BUAMCAT1,BUAMCAT1XXX,BURGUNDY ASSET MANAGEMENT
BUNWCAT1,BUNWCAT1XXX,UBS SECURITIES CANADA INC
BUPYCAT2,BUPYCAT2XXX,BUSINESSBANK PAY INC
CADSCA81,CADSCA81XXX,CANADIAN DEPOSITORY FOR SECURITIES
CALWCAT1,CALWCAT1XXX,CALDWELL SECURITIES LTD.
CANCCA81,CANCCA81DTC,CANACCORD CAPITAL CORPORATION
CANCCA81,CANCCA81XXX,CANACCORD CAPITAL CORPORATION
CASCCAM1,CASCCAM1XXX,CASGRAIN ET COMPAGNIE LIMITEE
CAUOCA91,CAUOCA91XXX,CAISSE POPULAIRE ACADIENNE LTEE
CAVUCAT1,CAVUCAT1XXX,CANSO INVESTMENT COUNSEL LTD.
CCCSCAT1,CCCSCAT1XXX,CANADIAN CO-OPERATIVE CREDIT SOCIETY
CCDQCAM2,CCDQCAM2XXX,FEDERATION DES CAISSES DESJARDINS DU QUEBEC
CCDQCAMA,CCDQCAMAXXX,FEDERATION DES CAISSES DESJARDINS DU QUEBEC
CCDQCAMM,CCDQCAMMFID,FEDERATION DES CAISSES DESJARDINS DU QUEBEC
CCDQCAMM,CCDQCAMMIMM,FEDERATION DES CAISSES DESJARDINS DU QUEBEC
CCDQCAMM,CCDQCAMMXXX,FEDERATION DES CAISSES DESJARDINS DU QUEBEC
CCGSCAT2,CCGSCAT2XXX,CANADA POST CORPORATION REGISTERED PENSION PLAN
CCTMCAM1,CCTMCAM1XXX,COERENTE CAPITAL MANAGEMENT INC.
CDCCCAM1,CDCCCAM1XXX,CANADIAN DERIVATIVES CLEARING CORP
CDCNCA21,CDCNCA21XXX,CAISSE DESJARDINS DES CHUTES MONTMORENCY
CDICCAW2,CDICCAW2XXX,CANADA DEPOSIT INSURANCE CORPORATION
CDPECAM1,CDPECAM1XXX,CAISSE DE DEPOT ET PLACEMENT DU QUEBEC
CDSLCAT1,CDSLCAT106C,CDS CLEARING AND DEPOSITORY SERVICES INC.
CDSLCAT1,CDSLCAT108V,CDS CLEARING AND DEPOSITORY SERVICES INC.
CDSLCAT1,CDSLCAT10MM,CDS CLEARING AND DEPOSITORY SERVICES INC.
CDSLCATT,CDSLCATTSMD,CDS CLEARING AND DEPOSITORY SERVICES INC.
CDSLCATT,CDSLCATTXXX,CDS CLEARING AND DEPOSITORY SERVICES INC.
CETHCA62,CETHCA62XXX,CEDE TECHNOLOGIES INC.
CGAACAM1,CGAACAM1XXX,CIBC ASSET MANAGEMENT INC.
CGAACAMB,CGAACAMBXXX,CIBC ASSET MANAGEMENT INC.
CHASCATT,CHASCATTCTS,"JPMORGAN CHASE BANK, TORONTO BRANCH"
CHASCATT,CHASCATTENQ,"JPMORGAN CHASE BANK, TORONTO BRANCH"
CHASCATT,CHASCATTNVS,"JPMORGAN CHASE BANK, TORONTO BRANCH"
CHASCATT,CHASCATTXXX,"JPMORGAN CHASE BANK, TORONTO BRANCH"
CHZICA82,CHZICA82XXX,CHIIZU INC.
CIAECAM1,CIAECAM1XXX,CIBC ASSET MANAGEMENT INC.
CIBCCATT,CIBCCATTCLS,CANADIAN IMPERIAL BANK OF COMMERCE
CIBCCATT,CIBCCATTCMI,CANADIAN IMPERIAL BANK OF COMMERCE
CIBCCATT,CIBCCATTCWM,CANADIAN IMPERIAL BANK OF COMMERCE
CIBCCATT,CIBCCATTMPS,CANADIAN IMPERIAL BANK OF COMMERCE
CIBCCATT,CIBCCATTXXX,CANADIAN IMPERIAL BANK OF COMMERCE
CIEMCAM1,CIEMCAM1XXX,CIBC ASSET MANAGEMENT INC.
CITCCATT,CITCCATTXXX,CITCO BANK CANADA
CITICATT,CITICATT615,CITIBANK CANADA
CITICATT,CITICATT617,CITIBANK CANADA
CITICATT,CITICATT623,CITIBANK CANADA
CITICATT,CITICATTBCH,CITIBANK CANADA
CITICATT,CITICATTCTI,CITIBANK CANADA
CITICATT,CITICATTEUC,CITIBANK CANADA
CITICATT,CITICATTXXX,CITIBANK CANADA
CLENCAT1,CLENCAT1XXX,TD PD CLEARING
CLERCAT1,CLERCAT1XXX,TD MS CLEARING
CLGBCA62,CLGBCA62XXX,CLARITY GLOBAL INC
CLNVCAT1,CLNVCAT1XXX,IA CLARINGTON INVESTMENTS INC.
CLSTCAT1,CLSTCAT1XXX,CLARUS SECURITIES INC
CLTCCATT,CLTCCATTXXX,CLEAR STREET CANADA INC.
CLVMCAT2,CLVMCAT2XXX,CALDWELL INVESTMENT MANAGEMENT LTD.
CMCKCAT2,CMCKCAT2XXX,CMC MARKETS CANADA INC.
CMFXCATT,CMFXCATTXXX,CAMBRIDGE MERCANTILE CORP.
CMHCCAW2,CMHCCAW2XXX,CANADA MORTGAGE AND HOUSING CORPORATION
CMTFCAM1,CMTFCAM1XXX,CN CANADIAN MASTER TRUST FUND
CMTYCATB,CMTYCATBXXX,CIBC MELLON TRUST COMPANY
CMTYCATT,CMTYCATTXXX,CIBC MELLON TRUST COMPANY
CMYCCAT2,CMYCCAT2XXX,CAPI MONEY CANADA LTD.
CNDACA62,CNDACA62XXX,CANADIANFOREX LIMITED
CNFNCAT1,CNFNCAT1XXX,CANOE FINANCIAL LP
CNIOCATT,CNIOCATTXXX,CANSO INVESTMENT COUNSEL LTD.
CNLACA44,CNLACA44CLI,THE CANADA LIFE ASSURANCE COMPANY
CNLACA44,CNLACA44XXX,THE CANADA LIFE ASSURANCE COMPANY
CNLACA4B,CNLACA4BXXX,THE CANADA LIFE ASSURANCE COMPANY
CNLACA4C,CNLACA4CXXX,THE CANADA LIFE ASSURANCE COMPANY
CNORCATT,CNORCATTXXX,"THE NORTHERN TRUST COMPANY, CANADA"
CNRPCA91,CNRPCA91XXX,GS CANADA CREDIT PARTNERS CO.
CNTICA21,CNTICA21XXX,CONTINENTAL BANK OF CANADA
CPAACA22,CPAACA22XXX,CANADIAN PAYMENTS ASSOCIATION
CPAACA23,CPAACA23XXX,CANADIAN PAYMENTS ASSOCIATION
CPAACA2A,CPAACA2AXXX,CANADIAN PAYMENTS ASSOCIATION
CPGPCAWA,CPGPCAWAXXX,CANADA POST CORPORATION REGISTERED PENSION PLAN
CPPBCATA,CPPBCATAXXX,CANADA PENSION PLAN INVESTMENT BOARD
CPPBCATT,CPPBCATTXXX,CANADA PENSION PLAN INVESTMENT BOARD
CRLYCAM1,CRLYCAM1XXX,CREDIT AGRICOLE CORPORATE AND INVESTMENT BANK
CRNDCA21,CRNDCA21XXX,VW CREDIT CANADA
CRNLCA81,CRNLCA81XXX,AVISO WEALTH INC
CRNLCA8V,CRNLCA8VXXX,AVISO FINANCIAL INC.
CSECCAT1,CSECCAT1XXX,CREDIFINANCE SECURITIES LIMITED
CSFBCAT1,CSFBCAT1XXX,"CREDIT SUISSE SECURITIES (CANADA), INC"
CTBLCA66,CTBLCA66XXX,CIDEL TRUST COMPANY
CTBLCAT3,CTBLCAT3XXX,CIDEL BANK CANADA
CTBLCATT,CTBLCATTXXX,CIDEL ASSET MANAGEMENT INC
CTCBCA8V,CTCBCA8VXXX,CTBC BANK CORP. (CANADA)
CTICCAM1,CTICCAM1XXX,CTI CAPITAL GROUP INC
CTZNCA8V,CTZNCA8V001,VANCOUVER CITY SAVINGS CREDIT UNION
CTZNCA8V,CTZNCA8VXXX,VANCOUVER CITY SAVINGS CREDIT UNION
CUCHCA52,CUCHCA52XXX,CREDIT UNION CENTRAL OF SASKATCHEWAN
CUCXCATT,CUCXCATTCAL,CENTRAL 1 CREDIT UNION
CUCXCATT,CUCXCATTINV,CENTRAL 1 CREDIT UNION
CUCXCATT,CUCXCATTONT,CENTRAL 1 CREDIT UNION
CUCXCATT,CUCXCATTREG,CENTRAL 1 CREDIT UNION
CUCXCATT,CUCXCATTVAN,CENTRAL 1 CREDIT UNION
CUCXCATT,CUCXCATTWPG,CENTRAL 1 CREDIT UNION
CUCXCATT,CUCXCATTXXX,CENTRAL 1 CREDIT UNION
CUDCCA92,CUDCCA92XXX,CURRENCIES DIRECT CANADA INC
CUELCA62,CUELCA62XXX,CREDIT UNION CENTRAL ALBERTA LIMITED
CUSOCAT1,CUSOCAT1XXX,"TD CUSTODY, C AND IS"
CWBKCA61,CWBKCA6108V,CANADIAN WESTERN BANK
CWBKCA61,CWBKCA61XXX,CANADIAN WESTERN BANK
DAFNCA82,DAFNCA82XXX,DAXIL FINANCE LTD.
DCCOCAT1,DCCOCAT1XXX,DUNDEE SECURITIES LTD
DDMSCAT1,DDMSCAT1XXX,DOMINICK AND DOMINICK SSECURITIES INC. DOMINICK AND DOMINICK VALEURS INC.
DENNCA82,DENNCA82XXX,DESTA FINANCE LTD
DEUTCATT,DEUTCATTXXX,"DEUTSCHE BANK AG, CANADA BRANCH"
DFSECA82,DFSECA82XXX,DEIMA FINANCIAL SERVICES LTD.
DIEECA66,DIEECA66XXX,DIGITAL COMMERCE BANK
DMICCA82,DMICCA82XXX,DIXON MITCHELL INVESTMENT COUNSEL INC
DOASCAW1,DOASCAW1XXX,DOHERTY AND ASSOCIATES LIMITED
DRRSCAT1,DRRSCAT1XXX,DBRS LIMITED
DUNSCAT1,DUNSCAT1XXX,DUNDEE SECURITIES LTD
EBPCCA82,EBPCCA82XXX,EBURY PARTNERS CANADA LIMITED
EDCCCAT1,EDCCCAT1XXX,EDGECREST CAPITAL CORPORATION
EDCOCAW2,EDCOCAW2XXX,EXPORT DEVELOPMENT CANADA
EDDJCAM1,EDDJCAM1XXX,EDWARD JONES
EDIGCAT1,EDIGCAT1XXX,EDGEPOINT INVESTMENT GROUP INC
EDWECAT1,EDWECAT1XXX,EDGEPOINT WEALTH MANAGEMENT INC
ENCRCA88,ENCRCA88XXX,ENCOREFX INC.
EQFXCAT1,EQFXCAT1XXX,EQUITY FINANCIAL FX INC.
FAGCCA22,FAGCCA22XXX,FALCON GLOBAL CAPITAL INC.
FAIICAT1,FAIICAT1XXX,FIRST ASSOCIATES INVESTMENTS INC.
FBDBCAM1,FBDBCAM1XXX,BUSINESS DEVELOPMENT BANK OF CANADA
FCAICAM2,FCAICAM2XXX,FIERA CAPITAL CORPORATION
FCAICAMM,FCAICAMMXXX,FIERA CAPITAL CORPORATION
FCBBCA22,FCBBCA22XXX,FCB NA LTD.
FCBKCA8V,FCBKCA8V909,"FIRST COMMERCIAL BANK, VANCOUVER BRANCH"
FCBKCA8V,FCBKCA8VXXX,"FIRST COMMERCIAL BANK, VANCOUVER BRANCH"
FCCLCAT1,FCCLCAT1XXX,"FIDELITY CLEARING CANADA, ULC"
FCCLCATT,FCCLCATTXXX,"FIDELITY CLEARING CANADA, ULC"
FCPMCA41,FCPMCA41XXX,FEDERATION DES CAISSES POPULAIRES DU MANITOBA
FCPOCAM1,FCPOCAM1XXX,FEDERATION DE CAISSES POPULAIRES DES JARDINS DE MONTREAL
FCSCCAT1,FCSCCAT1XXX,FIRST CANADIAN SECURITIES FUNDS INC
FCTICATT,FCTICATTXXX,FCT INSURANCE COMPANY LTD
FDPYCA82,FDPYCA82XXX,PAPEL E-MONEY SERVICES LTD.
FEMPCA82,FEMPCA82XXX,FERMION ELECTRONIC MONEY PLATFORM LIMITED
FENGCA61,FENGCA61XXX,FIRST ENERGY CAPITAL
FFFXCA66,FFFXCA66XXX,FIRMA FOREIGN EXCHANGE CORPORATION
FFSOCAT2,FFSOCAT2XXX,FLOAT FINANCIAL SOLUTIONS INC.
FIDDCAM1,FIDDCAM1XXX,FIDUCIE DESJARDINS
FIFPCA82,FIFPCA82XXX,FINFLARE PAYMENTS LTD
FIYMCAW2,FIYMCAW2XXX,FINVOKA PAYMENTS INC.
FIYYCA82,FIYYCA82XXX,FINVISE PAY LTD.
FMCCCAT1,FMCCCAT1BAM,SS AND C TECHNOLOGIES CANADA CORP.
FMCCCATM,FMCCCATMAEG,SS AND C TECHNOLOGIES CANADA CORP.
FMCCCATM,FMCCCATMBUD,SS AND C TECHNOLOGIES CANADA CORP.
FMCCCATM,FMCCCATMCAM,SS AND C TECHNOLOGIES CANADA CORP.
FMCCCATM,FMCCCATMCBA,SS AND C TECHNOLOGIES CANADA CORP.
FMCCCATM,FMCCCATMDEA,SS AND C TECHNOLOGIES CANADA CORP.
FMCCCATM,FMCCCATMDOR,SS AND C TECHNOLOGIES CANADA CORP.
FMCCCATM,FMCCCATMEIS,SS AND C TECHNOLOGIES CANADA CORP.
FMCCCATM,FMCCCATMFIN,SS AND C TECHNOLOGIES CANADA CORP.
FMCCCATM,FMCCCATMGMA,SS AND C TECHNOLOGIES CANADA CORP.
FMCCCATM,FMCCCATMGOO,SS AND C TECHNOLOGIES CANADA CORP.
FMCCCATM,FMCCCATMHOP,SS AND C TECHNOLOGIES CANADA CORP.
FMCCCATM,FMCCCATMIKO,SS AND C TECHNOLOGIES CANADA CORP.
FMCCCATM,FMCCCATMIPF,SS AND C TECHNOLOGIES CANADA CORP.
FMCCCATM,FMCCCATMJST,SS AND C TECHNOLOGIES CANADA CORP.
FMCCCATM,FMCCCATMMFC,SS AND C TECHNOLOGIES CANADA CORP.
FMCCCATM,FMCCCATMOME,SS AND C TECHNOLOGIES CANADA CORP.
FMCCCATM,FMCCCATMOST,SS AND C TECHNOLOGIES CANADA CORP.
FMCCCATM,FMCCCATMOTP,SS AND C TECHNOLOGIES CANADA CORP.
FMCCCATM,FMCCCATMPEM,SS AND C TECHNOLOGIES CANADA CORP.
FMCCCATM,FMCCCATMPSP,SS AND C TECHNOLOGIES CANADA CORP.
FMCCCATM,FMCCCATMWAR,SS AND C TECHNOLOGIES CANADA CORP.
FMCCCATM,FMCCCATMXXX,SS AND C TECHNOLOGIES CANADA CORP.
FNMNCAW2,FNMNCAW2XXX,MD FINANCIAL MANAGEMENT INC
FNPYCA82,FNPYCA82XXX,LEVEX FINTECH CANADA LTD.
FNTNCAT2,FNTNCAT2XXX,FINCRA TECHNOLOGIES LIMITED
FOAICA82,FOAICA82XXX,MYDUCAT CA LTD.
FOGOCAM1,FOGOCAM1XXX,FORMULA GROWTH LIMITED
FOGYCAT1,FOGYCAT1XXX,"FOYSTON, GORDON AND PAYNE INC."
FRDMCAT1,FRDMCAT1XXX,FREEDOM INTERNATIONAL BROKERAGE COMPANY
FSRVCAT1,FSRVCAT1XXX,"FUNDSERV, INC."
GCMICA81,GCMICA81XXX,GENUS CAPITAL MANAGEMENT INC.
GECRCAT1,GECRCAT1XXX,CANACCORD GENUITY GROUP INC
GEEYCA82,GEEYCA82XXX,GLEEC PAY LTD.
GFMICATT,GFMICATTXXX,SAGEN MORTGAGE INSURANCE COMPANY CANADA
GLCDCA91,GLCDCA91XXX,GS GLOBAL COMMODITIES (CANADA) CORP
GLSACAT1,GLSACAT1XXX,GLUSKIN SHEFF AND ASSOCIATES INC
GOCCCAM1,GOCCCAM10TT,GORDON CAPITAL CORPORATION
GOCCCAM1,GOCCCAM1XXX,GORDON CAPITAL CORPORATION
GORFCAW2,GORFCAW2XXX,GOLDEN RAIN FINANCE LIMITED
GPHDCAM1,GPHDCAM1XXX,GESTION DE PLACEMENTS HELENE DION INC.
GPMACA81,GPMACA81XXX,DUNDEE SECURITIES LTD
GRCDCA21,GRCDCA21XXX,VOLKSWAGEN GROUP CANADA INC
GRFACA91,GRFACA91XXX,GREYS FINANCIAL LIMITED
GRISCAT1,GRISCAT1XXX,GREENLINE INVESTOR SERVICES INC.
GRMNCA51,GRMNCA51XXX,GREYSTONE MANAGED INVESTMENTS INC
GRMPCAT1,GRMPCAT1XXX,RF SECURITIES CLEARING LP
GSCICA91,GSCICA91XXX,GOLDMAN SACHS CANADA FINANCE CO.
GSECCA81,GSECCA81XXX,GLOBAL SECURITIES CORPORATION
GSLTCAT1,GSLTCAT10GS,GOLDMAN SACHS CANADA
GSLTCAT1,GSLTCAT1XXX,GOLDMAN SACHS CANADA
GUAVCATT,GUAVCATTXXX,GUAVA PAY CANADA INC
GUCACATT,GUCACATTXXX,GUARDIAN CAPITAL LP
HASRCA81,HASRCA81XXX,HAYWOOD SECURITIES INC.
HBZUCATT,HBZUCATTXXX,HABIB CANADIAN BANK
HIFXCATT,HIFXCATTXXX,XE CORPORATION
HIMTCAM1,HIMTCAM1XXX,HEWARD INVESTMENT MANAGEMENT INC
HIZOCA82,HIZOCA82XXX,HIZO TECHNOLOGY LIMITED
HKBCCA81,HKBCCA81XXX,ROYAL BANK OF CANADA
HKBCCATT,HKBCCATTCLS,ROYAL BANK OF CANADA
HKBCCATT,HKBCCATTINV,ROYAL BANK OF CANADA
HKBCCATT,HKBCCATTMON,ROYAL BANK OF CANADA
HKBCCATT,HKBCCATTVAN,ROYAL BANK OF CANADA
HKBCCATT,HKBCCATTXXX,ROYAL BANK OF CANADA
HORTCA22,HORTCA22XXX,HORIZONFLARE TECHNOLOGY LIMITED
HQPFCAM1,HQPFCAM1XXX,HYDRO QUEBEC PENSION FUND INC.
HSBCCAT1,HSBCCAT1XXX,"HSBC BANK USA, N.A.(TORONTO BRANCH)"
HSCICATT,HSCICATTXXX,ROYAL BANK OF CANADA
HUCTCA21,HUCTCA21XXX,MANULIFE BANK OF CANADA
HWICCAT1,HWICCAT1XXX,HAMBLIN WATSA INVESTMENT COUNSEL LT TD.
IANNCAMM,IANNCAMMXXX,INDUSTRIAL ALLIANCE INVESTMENT MANAGEMENT INC.
IBCNCAT1,IBCNCAT1XXX,IBM CANADA
IBKRCAMM,IBKRCAMMXXX,INTERACTIVE BROKERS CANADA INC.
IBTACA82,IBTACA82XXX,IBAN TRANSFER LIMITED
ICBCCATT,ICBCCATTRMD,"MEGA INTERNATIONAL COMMERCIAL BANK CO., LTD. CANADA BRANCH"
ICBCCATT,ICBCCATTVAN,"MEGA INTERNATIONAL COMMERCIAL BANK CO., LTD. CANADA BRANCH"
ICBCCATT,ICBCCATTXXX,"MEGA INTERNATIONAL COMMERCIAL BANK CO., LTD. CANADA BRANCH"
ICBKCAT2,ICBKCAT2CLR,INDUSTRIAL AND COMMERCIAL BANK OF CHINA (CANADA)
ICBKCAT2,ICBKCAT2XXX,INDUSTRIAL AND COMMERCIAL BANK OF CHINA (CANADA)
ICICCATT,ICICCATTCOP,ICICI BANK CANADA
ICICCATT,ICICCATTGTS,ICICI BANK CANADA
ICICCATT,ICICCATTRTL,ICICI BANK CANADA
ICICCATT,ICICCATTTSY,ICICI BANK CANADA
ICICCATT,ICICCATTXXX,ICICI BANK CANADA
ICNACA66,ICNACA66XXX,ICE NGX CANADA INC.
ICSOCATT,ICSOCATTXXX,ITALIAN CANADIAN SAVINGS AND CREDIT UNION LIMITED
IGMFCA44,IGMFCA44001,INVESTORS GROUP FINANCIAL SERVICES INC
IGMFCA44,IGMFCA44002,INVESTORS GROUP FINANCIAL SERVICES INC
IGMFCA44,IGMFCA44003,INVESTORS GROUP FINANCIAL SERVICES INC
IGMFCA44,IGMFCA44004,INVESTORS GROUP FINANCIAL SERVICES INC
IGMFCA44,IGMFCA44XXX,INVESTORS GROUP FINANCIAL SERVICES INC
IMROCATB,IMROCATBXXX,INVESTMENT MANAGEMENT CORPORATION OF ONTARIO
IMROCATT,IMROCATTXXX,INVESTMENT MANAGEMENT CORPORATION OF ONTARIO
INCDCAT1,INCDCAT1XXX,INSTINET CANADA
INVTCAM1,INVTCAM1XXX,FIN-XO VALEURS MOBILIERES INC. FIN- XO SECURITIES INC.
ISPACA82,ISPACA82XXX,ISWISS PAY LIMITED
ITCDCA81,ITCDCA81XXX,INTERPAY LTD
ITIMCAM2,ITIMCAM2XXX,INTACT INVESTMENT MANAGEMENT INC.
IVADCAT1,IVADCAT1XXX,RP INVESTMENT ADVISORS LP
IVSACAT1,IVSACAT1XXX,GS INVESTMENT STRATEGIES CANADA INC.
JDMACA91,JDMACA91XXX,NATIONAL BANK FINANCIAL INC
JEFFCATT,JEFFCATTXXX,"JEFFERIES SECURITIES, INC."
JFIFCA82,JFIFCA82XXX,JSC-JUERGEN FITSCHEN AND CO. INTERNATIONALE FINANZDIENSTLEISTUNG A.G.
JPMSCATT,JPMSCATTXXX,J.P. MORGAN SECURITIES CANADA INC.
JREFCAT2,JREFCAT2XXX,"JAPAN REMIT FINANCE CO., LTD."
JUNPCA62,JUNPCA62XXX,JUNO PAY LTD
KAMFCAM1,KAMFCAM1XXX,KASH MART FINANCIAL LTD
KEECCA22,KEECCA22XXX,KEEP TECHNOLOGIES CORP.
KEYRCA62,KEYRCA62XXX,KEYRAILS INC
KOEXCATT,KOEXCATTXXX,KEB HANA BANK CANADA
LAHPCAM1,LAHPCAM1XXX,LAFFERTY HARWOOD AND PARTNERS LTD.
LAPMCA82,LAPMCA82XXX,LAPSA PAYMENTS LTD.
LATLCAT1,LATLCAT1XXX,W.D. LATIMER CO. LIMITED
LBGECAM1,LBGECAM10TT,NATIONAL BANK FINANCIAL INC
LBGECAM1,LBGECAM1XXX,NATIONAL BANK FINANCIAL INC
LICDCAT1,LICDCAT1XXX,DD LIQUIDNET CANADA INC.
LOIVCA91,LOIVCA91XXX,LOUISBURG INVESTMENTS INC.
LOTCCA62,LOTCCA62XXX,LOWBEE TECHNOLOGIES LIMITED
LUOCCA22,LUOCCA22XXX,LUOPAY CANADA LTD
LWICCA81,LWICCA81XXX,LEITH WHEELER INVESTMENT COUNSEL LTD
LWOHCAT1,LWOHCAT1XXX,"LOEWEN, ONDAATJE, MCCUTCHEON LIMITED"
MAFCCAT1,MAFCCAT1XXX,MACKENZIE FINANCIAL CORPORATION
MAIPCAM1,MAIPCAM1XXX,MAISON PLACEMENTS CANADA INC.
MALECAM1,MALECAM1XXX,DUNDEE SECURITIES LTD
MAPCCAT1,MAPCCAT1XXX,MAISON PLACEMENTS CA INC.
MBIMCAMM,MBIMCAMMXXX,MONTRUSCO BOLTON INVESTMENTS INC.
MCMCCAM1,MCMCCAM1XXX,"MACDOUGALL, MACDOUGALL AND MACTIER INC."
MCMICAT1,MCMICAT1XXX,DEUTSCHE BANK SECURITIES LIMITED
MCOTCAT1,MCOTCAT1XXX,SUN LIFE FINANCIAL TRUST INC
MEDYCAT2,MEDYCAT2XXX,MEDIACUBE PAY INC.
MELNCATT,MELNCATTXXX,"THE BANK OF NEW YORK MELLON, TORONTO BRANCH"
MEMTCAT2,MEMTCAT2XXX,MERCURY MERCANTILE TECHNOLOGIES INC
MEPNCA82,MEPNCA82XXX,METAX PAYMENTS LTD
MEXOCAT2,MEXOCAT2XXX,MERCANTILE EXCHANGE CORPORATION
MFCTCATA,MFCTCATAXXX,THE MANUFACTURERS LIFE INSURANCE COMPANY
MFCTCATB,MFCTCATBXXX,THE MANUFACTURERS LIFE INSURANCE COMPANY
MFCTCATK,MFCTCATKXXX,THE MANUFACTURERS LIFE INSURANCE COMPANY
MFCTCATT,MFCTCATTXXX,MANULIFE FINANCIAL CORPORATION
MHCBCATT,MHCBCATTXXX,"MIZUHO BANK, LTD., CANADA BRANCH"
MINCCAT1,MINCCAT1XXX,MERIT INVESTMENT CORPORATION
MIRICAMM,MIRICAMMXXX,MIRABAUD CANADA INC.
MLCICATT,MLCICATTTOR,MERRILL LYNCH CANADA INC
MLCICATT,MLCICATTTSY,MERRILL LYNCH CANADA INC
MLCICATT,MLCICATTXXX,MERRILL LYNCH CANADA INC
MLFNCA82,MLFNCA82XXX,MOLTOPAY FINANCIAL LIMITED
MNCACATT,MNCACATTXXX,"MONEX CANADA, INC."
MODDCAT1,MODDCAT1XXX,MOODY'S CANADA INC.
MOFOCA82,MOFOCA82XXX,MONEYWAY FINANCIAL GROUP CORP.
MOTBCATT,MOTBCATTXXX,MONTOWIRE MSB LTD
MRCTCAT2,MRCTCAT2XXX,MAPLE ROCK CAPITAL PARTNERS INC.
MRCUCA21,MRCUCA21XXX,MERIDIAN CREDIT UNION LIMITED
MSCACATX,MSCACATXMON,MORGAN STANLEY CANADA LIMITED
MSCACATX,MSCACATXXXX,MORGAN STANLEY CANADA LIMITED
MSCDCA8V,MSCDCA8VXXX,"MUFG SECURITIES (CANADA), LTD"
MSICCA82,MSICCA82XXX,MASSIVE COMMERCE LTD
MTENCA82,MTENCA82XXX,MELON TECHNOLOGIES LIMITED
MTLXCAT2,MTLXCAT2XXX,MONTELUX PAYMENTS LTD
MTXXCA22,MTXXCA22XXX,MTFX INC
MUCGCAT1,MUCGCAT1XXX,MULVIHILL CAPITAL MANAGEMENT
MUNPCA8V,MUNPCA8VXXX,MULTIGATE NETWORK PAY INC.
NAPCCAT2,NAPCCAT2XXX,NALA PAYMENTS CANADA INC.
NATXCAMM,NATXCAMMXXX,NATIXIS CANADA BRANCH
NECCCA91,NECCCA91XXX,NEWFOUNDLAND CAPITAL CORPORATION LT D.
NESUCAM1,NESUCAM10TT,NESBITT BURNS
NESUCAM1,NESUCAM1XXX,NESBITT BURNS
NEWGCAMM,NEWGCAMMXXX,SOCIETE GENERALE CAPITAL CANADA INC
NIPACA22,NIPACA22XXX,NINEPOINT PARTNERS LP
NIWMCA82,NIWMCA82XXX,NICOLA WEALTH MANAGEMENT LTD.
NOPMCAT2,NOPMCAT2XXX,NOLIMIT PAYMENTS LTD.
NOSCCATM,NOSCCATMCMS,THE BANK OF NOVA SCOTIA
NOSCCATM,NOSCCATMESC,THE BANK OF NOVA SCOTIA
NOSCCATM,NOSCCATMGLS,THE BANK OF NOVA SCOTIA
NOSCCATM,NOSCCATMGTB,THE BANK OF NOVA SCOTIA
NOSCCATM,NOSCCATMPBG,THE BANK OF NOVA SCOTIA
NOSCCATM,NOSCCATMREC,THE BANK OF NOVA SCOTIA
NOSCCATM,NOSCCATMSEC,THE BANK OF NOVA SCOTIA
NOSCCATM,NOSCCATMWM1,THE BANK OF NOVA SCOTIA
NOSCCATM,NOSCCATMXXX,THE BANK OF NOVA SCOTIA
NOSCCATT,NOSCCATTBPS,THE BANK OF NOVA SCOTIA
NOSCCATT,NOSCCATTBSM,THE BANK OF NOVA SCOTIA
NOSCCATT,NOSCCATTCGY,THE BANK OF NOVA SCOTIA
NOSCCATT,NOSCCATTCLS,THE BANK OF NOVA SCOTIA
NOSCCATT,NOSCCATTCOL,THE BANK OF NOVA SCOTIA
NOSCCATT,NOSCCATTCST,THE BANK OF NOVA SCOTIA
NOSCCATT,NOSCCATTCT1,THE BANK OF NOVA SCOTIA
NOSCCATT,NOSCCATTCT2,THE BANK OF NOVA SCOTIA
NOSCCATT,NOSCCATTFXA,THE BANK OF NOVA SCOTIA
NOSCCATT,NOSCCATTGES,THE BANK OF NOVA SCOTIA
NOSCCATT,NOSCCATTGLS,THE BANK OF NOVA SCOTIA
NOSCCATT,NOSCCATTHFX,THE BANK OF NOVA SCOTIA
NOSCCATT,NOSCCATTIMP,THE BANK OF NOVA SCOTIA
NOSCCATT,NOSCCATTMOC,THE BANK OF NOVA SCOTIA
NOSCCATT,NOSCCATTMT1,THE BANK OF NOVA SCOTIA
NOSCCATT,NOSCCATTMTB,THE BANK OF NOVA SCOTIA
NOSCCATT,NOSCCATTMTL,THE BANK OF NOVA SCOTIA
NOSCCATT,NOSCCATTOTC,THE BANK OF NOVA SCOTIA
NOSCCATT,NOSCCATTOTT,THE BANK OF NOVA SCOTIA
NOSCCATT,NOSCCATTSEC,THE BANK OF NOVA SCOTIA
NOSCCATT,NOSCCATTSKN,THE BANK OF NOVA SCOTIA
NOSCCATT,NOSCCATTSTF,THE BANK OF NOVA SCOTIA
NOSCCATT,NOSCCATTTB5,THE BANK OF NOVA SCOTIA
NOSCCATT,NOSCCATTTFS,THE BANK OF NOVA SCOTIA
NOSCCATT,NOSCCATTTL1,THE BANK OF NOVA SCOTIA
NOSCCATT,NOSCCATTTL2,THE BANK OF NOVA SCOTIA
NOSCCATT,NOSCCATTTL3,THE BANK OF NOVA SCOTIA
NOSCCATT,NOSCCATTTL4,THE BANK OF NOVA SCOTIA
NOSCCATT,NOSCCATTTL5,THE BANK OF NOVA SCOTIA
NOSCCATT,NOSCCATTTL6,THE BANK OF NOVA SCOTIA
NOSCCATT,NOSCCATTTL7,THE BANK OF NOVA SCOTIA
NOSCCATT,NOSCCATTTL8,THE BANK OF NOVA SCOTIA
NOSCCATT,NOSCCATTTL9,THE BANK OF NOVA SCOTIA
NOSCCATT,NOSCCATTTLA,THE BANK OF NOVA SCOTIA
NOSCCATT,NOSCCATTTLB,THE BANK OF NOVA SCOTIA
NOSCCATT,NOSCCATTTLC,THE BANK OF NOVA SCOTIA
NOSCCATT,NOSCCATTTLD,THE BANK OF NOVA SCOTIA
NOSCCATT,NOSCCATTTLE,THE BANK OF NOVA SCOTIA
NOSCCATT,NOSCCATTTOR,THE BANK OF NOVA SCOTIA
NOSCCATT,NOSCCATTTPC,THE BANK OF NOVA SCOTIA
NOSCCATT,NOSCCATTTPG,THE BANK OF NOVA SCOTIA
NOSCCATT,NOSCCATTTPM,THE BANK OF NOVA SCOTIA
NOSCCATT,NOSCCATTTPT,THE BANK OF NOVA SCOTIA
NOSCCATT,NOSCCATTTPV,THE BANK OF NOVA SCOTIA
NOSCCATT,NOSCCATTTPW,THE BANK OF NOVA SCOTIA
NOSCCATT,NOSCCATTTR1,THE BANK OF NOVA SCOTIA
NOSCCATT,NOSCCATTVCR,THE BANK OF NOVA SCOTIA
NOSCCATT,NOSCCATTWPG,THE BANK OF NOVA SCOTIA
NOSCCATT,NOSCCATTXXX,THE BANK OF NOVA SCOTIA
NTCCCAT1,NTCCCAT1XXX,"THE NORTHERN TRUST COMPANY, CANADA BRANCH"
NTTACA22,NTTACA22XXX,NOTA INC
ODLUCA81,ODLUCA810TT,ODLUM BROWN LIMITED
ODLUCA81,ODLUCA81XXX,ODLUM BROWN LIMITED
OMACCAT1,OMACCAT1XXX,OMERS ADMINISTRATION CORPORATION
OMEXCAT2,OMEXCAT2XXX,OMEXI PAY LIMITED
OMNICAM1,OMNICAM1XXX,OMNI CAPITAL INC.
ONPBCAT1,ONPBCAT1XXX,ONTARIO PENSION BOARD
OTPBCA21,OTPBCA21XXX,ONTARIO TEACHERS' PENSION PLAN BOARD
OTPBCA2T,OTPBCA2TXXX,ONTARIO TEACHERS' PENSION PLAN BOARD
PAEHCA81,PAEHCA81XXX,PAYLINE BY ICE LIMITED PARTNERSHIP
PARDCAT1,PARDCAT1XXX,PARADIGM CAPITAL INC.
PAUOCA22,PAUOCA22XXX,BZ PAYMENT SOLUTION INC.
PAVXCA92,PAVXCA92XXX,PAYVEXA INC.
PCBCCATT,PCBCCATTXXX,CHINA CONSTRUCTION BANK TORONTO BRANCH
PEICCA82,PEICCA82XXX,ME PAY LTD.
PELDCA82,PELDCA82XXX,PAYDO CANADA LTD
PEPCCA22,PEPCCA22XXX,PESAPEER INCORPORATED
PESMCAM1,PESMCAM1XXX,PRESIMA INC.
PFSICAM1,PFSICAM1XXX,PENSON FINANCIAL SERVICES CANADA INC.
PFSICAT1,PFSICAT1XXX,PENSON FINANCIAL SERVICES CANADA
PICTCAM2,PICTCAM2COR,PICTET OVERSEAS INC.
PICTCAM2,PICTCAM2XXX,PICTET OVERSEAS INC.
PICTCAMM,PICTCAMMCOR,PICTET CANADA L.P.
PICTCAMM,PICTCAMMCUS,PICTET CANADA L.P.
PICTCAMM,PICTCAMMXXX,PICTET CANADA L.P.
PIMHCA21,PIMHCA21XXX,PICTON MAHONEY ASSET MANAGEMENT
PISICA81,PISICA81XXX,PACIFIC INTERNATIONAL SEC. INC.
PLCDCAT2,PLCDCAT2XXX,PLAUDE CANADA INC
PNBPCATT,PNBPCATTLIQ,"WELLS FARGO BANK, N. A. CANADIAN BRANCH"
PNBPCATT,PNBPCATTXXX,"WELLS FARGO BANK, N. A. CANADIAN BRANCH"
PNCCCA22,PNCCCA22XXX,PNC BANK CANADA BRANCH
POLLCAT1,POLLCAT1XXX,POLLITT AND CO INC.
POSUCAT1,POSUCAT1XXX,POLAR ASSET MANAGEMENT PARTNERS INC
PPECCAT1,PPECCAT1XXX,POPE AND COMPANY
PPIMCAM2,PPIMCAM2XXX,POWER PACIFIC INVESTMENT MANAGEMENT INC.
PRHECAW2,PRHECAW2XXX,PARADIS TECH LTD.
PRSHCA91,PRSHCA91XXX,PERSHING SECURITIES CANADA LIMITED
PSFICA82,PSFICA82XXX,PSTNET FINANCE CORP.
PSPBCA21,PSPBCA21XXX,PUBLIC SECTOR PENSION INVESTMENT BOARD
PSPBCAMA,PSPBCAMAXXX,PUBLIC SECTOR PENSION INVESTMENT BOARD
PSPBCAMM,PSPBCAMMXXX,PUBLIC SECTOR PENSION INVESTMENT BOARD
PTCOCA61,PTCOCA61XXX,PETERS AND CO. LIMITED
PUMLCA82,PUMLCA82XXX,PURSE MONEY PLATFORM LTD
PUTDCA82,PUTDCA82XXX,PUREMTEK TRADING LTD.
PUTFCA82,PUTFCA82XXX,PURE TRANSFER LTD
PYCLCAT1,PYCLCAT1XXX,PREBON YAMANE (CANADA) LIMITED
PYCNCA82,PYCNCA82XXX,PAYWRX CONNECT LTD
PYFACA82,PYFACA82XXX,GRANPAY FINANCE LTD.
PYFCCA82,PYFCCA82XXX,VAULTZ CAPITAL LTD.
PYFICA82,PYFICA82XXX,PAYSIMPLE FINANCIAL INC
QUERCA21,QUERCA21XXX,QUESTRADE INC.
QUERCAT1,QUERCAT1XXX,QUESTRADE INC.
RABOCATT,RABOCATTXXX,COOPERATIEVE RABOBANK U.A.
RACRCAT1,RACRCAT1XXX,RADIN CAPITAL PARTNERS INC.
RBDSCAT1,RBDSCAT1XXX,RBC DOMINION SECURITIES INC.
RBDSCATR,RBDSCATRXXX,RBC DOMINION SECURITIES INC.
RBDSCAW1,RBDSCAW1XXX,RBC DOMINION SECURITIES INC
RBITCAR1,RBITCAR1XXX,RBC DIRECT INVESTING INC
RCAACAT1,RCAACAT1XXX,RIDGEWOOD CAPITAL ASSET MANAGEMENT INC
RECCCAT1,RECCCAT1SET,CORPORATION MACKIE RECHERCHE CAPITAL
RECCCAT1,RECCCAT1XXX,CORPORATION MACKIE RECHERCHE CAPITAL
REPDCAT2,REPDCAT2XXX,REMITWARE PAYMENTS CANADA INC
RGAMCAT1,RGAMCAT1RGA,RBC GLOBAL ASSET MANAGEMENT INC
RGAMCAT1,RGAMCAT1XXX,RBC GLOBAL ASSET MANAGEMENT INC
RHECCA82,RHECCA82XXX,REMITTANCES HUB ENTERPRISES CANADA LTD.
