bic_8,bic,bank
AASQPHM1,AASQPHM1XXX,AAA SOUTHEAST EQUITIES INC.
ABAEPHM1,ABAEPHM1XXX,ABACUS SECURITIES CORP.
ABTZPH21,ABTZPH21XXX,ABOITIZ EQUITY VENTURES INC. ABOITIZ BUILDING
ACICPHM1,ACICPHM1XXX,ABACUS CAPITAL AND INVESTMENT CORPORATION
ACKEPHM1,ACKEPHM1XXX,I. ACKERMAN AND CO INC
AGBUPHM1,AGBUPHM1XXX,"AGRIBUSINESS RURAL BANK, INC."
AIACPHM1,AIACPHM1GIO,AIA PHILIPPINES LIFE AND GENERAL INSURANCE COMPANY
AIACPHMM,AIACPHMMXXX,AIA PHILIPPINES LIFE AND GENERAL INSURANCE COMPANY
AIIPPHM1,AIIPPHM1XXX,AL-AMANAH ISLAMIC INVESTMENT BANK OF THE PHILIPPINES
ALKBPHM2,ALKBPHM2XXX,ALLBANK (A THRIFT BANK) INC
ALPCPHM1,ALPCPHM1XXX,ALPHA SECURITIES CORP.
ALSGPHM1,ALSGPHM1XXX,ALLIED SAVINGS BANK
AMONPHM1,AMONPHM1XXX,AMON SECURITIES CORP.
ANGPPHM1,ANGPPHM1XXX,ANGPING AND ASSO. SECURITIES INC.
ANSCPHM1,ANSCPHM1XXX,AB CAPITAL SECURITIES INC.
ANSGPHM1,ANSGPHM1XXX,"ANSALDO, GODINEZ AND CO. INC."
ANZBPHMX,ANZBPHMXXXX,AUSTRALIA AND NEW ZEALAND BANKING GP (PHILIPPINES) LTD
APCEPHM1,APCEPHM1XXX,ASIA PACIFIC CAPITAL EQUITIES AND S EC. CORP.
APHIPHM2,APHIPHM2XXX,ALIPAY PHILIPPINES INC.
APHIPHM3,APHIPHM3XXX,ALIPAY PHILIPPINES INC.
ARMEPHM1,ARMEPHM1XXX,ARMSTRONG SECURITIES INC.
ASDBPHMM,ASDBPHMMXXX,ASIAN DEVELOPMENT BANK
ASDVPHM1,ASDVPHM1XXX,NEXTGENESIS CORPORATION
ASESPHM1,ASESPHM1XXX,ASIASEC EQUITIES INC.
ASIIPHM1,ASIIPHM1XXX,D'ASIAN HILLS BANK INC
ASISPHM1,ASISPHM1XXX,ASI SECURITIES INC.
ASTSPHM1,ASTSPHM1XXX,ASTRA SECURITIES CORP.
ATCSPHM1,ATCSPHM1XXX,ATC SECURITIES INC.
ATSCPHM1,ATSCPHM1XXX,"MAYBANK ATR KIM ENG SECURITIES, INC."
AUBKPHMM,AUBKPHMMXXX,ASIA UNITED BANK CORPORATION
AURSPHM1,AURSPHM1XXX,AURORA SECURITIES INC.
BADGPHM1,BADGPHM1XXX,"BANCODIPOLOG, INC."
BARNPHM1,BARNPHM1XXX,J.M. BARCELON AND CO INC
BATSPHM1,BATSPHM1XXX,BRITISH AMERICAN TOBACCO PHILIPPINES LTD.
BATTPHM1,BATTPHM1XXX,B A SECURITIES INC
BBOAPHM1,BBOAPHM1XXX,BSP BRANCH OPEN ACCOUNT SPC
BDESPHM1,BDESPHM1XXX,"BDO ELITE SAVINGS BANK, INC."
BDSCPHM1,BDSCPHM1XXX,BDO SECURITIES CORPORATION
BELCPHM1,BELCPHM1XXX,BELSON SECURITIES INC.
BENCPHM1,BENCPHM1XXX,H.E. BENNETT SECURITIES INC.
BENJPHM1,BENJPHM1XXX,BENJAMIN CO CA AND CO INC.
BEREPHM1,BEREPHM1XXX,BERNAD SECURITIES INC.
BFSCPHM1,BFSCPHM1XXX,BFE FINANCIAL SERVICES AND CONSULTANCY INC
BFSRPHM2,BFSRPHM2XXX,BANANA FINTECH SERVICES CORPORATION
BHCHPHM1,BHCHPHM1XXX,B. H. CHUA SECURITIES CORPORATION
BHFUPHM1,BHFUPHM1XXX,PROVIDENT FUND OFFICE (BSP-PFO)
BIURPHM2,BIURPHM2XXX,"BINAN RURAL BANK, INC."
BIUUPHM1,BIUUPHM1XXX,"BINANGONAN RURAL BANK, INC"
BKCHPHMM,BKCHPHMMRTS,BANK OF CHINA (HONG KONG) LIMITED- MANILA BRANCH
BKCHPHMM,BKCHPHMMXXX,BANK OF CHINA (HONG KONG) LIMITED- MANILA BRANCH
BKKBPHMM,BKKBPHMMXXX,BANGKOK BANK PUBLIC COMPANY LIMITED
BKRUPHM1,BKRUPHM1XXX,"BANCO BAKUN, INC. (A RURAL BANK)"
BNNNPH22,BNNNPH22XXX,"BANCNET, INC."
BNNNPHM2,BNNNPHM2XXX,"BANCNET, INC."
BNORPHMM,BNORPHMMXXX,"BDO UNIBANK, INC."
BOFAPH2X,BOFAPH2XXXX,"BANK OF AMERICA, N.A. MANILA"
BOPBPHMM,BOPBPHMMXXX,BDO PRIVATE BANK INC.
BOPIPHMM,BOPIPHMMTRY,BANK OF THE PHILIPPINE ISLANDS
BOPIPHMM,BOPIPHMMXXX,BANK OF THE PHILIPPINE ISLANDS
BORRPHM1,BORRPHM1XXX,"BOF, INC. (A RURAL BANK)"
BOTKPHMM,BOTKPHMMXXX,"MUFG BANK, LTD., MANILA BRANCH"
BPCNPHM1,BPCNPHM1XXX,BPI CARD FINANCE
BPDIPHM1,BPDIPHM1XXX,BPI DIRECT 8/F
BPFFPHM1,BPFFPHM1XXX,BPI FAMILY BANK 4TH FLOOR
BPFSPHM1,BPFSPHM1XXX,BANK OF THE PHILIPPINE ISLANDS
BPGOPHM1,BPGOPHM1XXX,BPI GLOBE BANKO INC.
BPISPHM1,BPISPHM1XXX,BPI SECURITIES CORP.
BPLIPHM1,BPLIPHM1XXX,BPI LEASING
BPPSPHM1,BPPSPHM1XXX,"BNP PARIBAS PEREGRINE SECURITIES, INC"
BPRFPHM1,BPRFPHM1XXX,BSP PROVIDENT FUND
BROXPHM1,BROXPHM1XXX,BARCELON ROXAS SECURITIES INC.
BRULPHM1,BRULPHM1XXX,"BALANGA RURAL BANK, INC."
BUTRPHM1,BUTRPHM1XXX,BUREAU OF THE TREASURY
CAMZPHM2,CAMZPHM2XXX,"CARD MRI RIZAL BANK, INC."
CASUPHM1,CASUPHM1XXX,A.T. DE CASTRO SECURITIES CORP.
CAVPPHM1,CAVPPHM1XXX,AB CAPITAL AND INVESTMENT CORPORATION
CBMFPHM1,CBMFPHM1XXX,"CARD BANK, INC. (A MICROFINANCE ORIENTED RURAL BANK)"
CBSLPHM1,CBSLPHM1XXX,COMMONWEALTH BANK/SAVINGS AND LOAN
CCBCPHMM,CCBCPHMMXXX,"CHANG HWA COMMERCIAL BANK,LTD. MANILA BRANCH"
CELRPHM1,CELRPHM1XXX,CEBUANA LHUILLIER RURAL BANK INC.
CENEPHM1,CENEPHM1XXX,CENTURY SECURITIES CORP.
CESNPHM1,CESNPHM1XXX,CENTURY SAVINGS BANK CORPORATION
CHASPHMM,CHASPHMMENQ,"JPMORGAN CHASE BANK, N.A. - MANILA BRANCH"
CHASPHMM,CHASPHMMOBU,"JPMORGAN CHASE BANK, N.A. - MANILA BRANCH"
CHASPHMM,CHASPHMMXXX,"JPMORGAN CHASE BANK, N.A. - MANILA BRANCH"
CHASPHS1,CHASPHS1XXX,"J.P. MORGAN SECURITIES PHILIPPINES INC., MANILLA"
CHBKPHMM,CHBKPHMMXXX,CHINA BANKING CORPORATION
CHCSPHM1,CHCSPHM1XXX,E. CHUA CHIACO SECURITIES INC.
CHSVPHM1,CHSVPHM1XXX,"CHINA BANK SAVINGS, INC."
CIPHPHM1,CIPHPHM1XXX,CIMB BANK PHILIPPINES INC.
CIPHPHMM,CIPHPHMMXXX,CIMB BANK PHILIPPINES INC.
CITIPH21,CITIPH21XXX,CITIBANK SAVINGS INC.
CITIPHMX,CITIPHMXAPR,CITIBANK N.A (MANILA BRANCH)
CITIPHMX,CITIPHMXCBU,CITIBANK N.A (MANILA BRANCH)
CITIPHMX,CITIPHMXPRA,CITIBANK N.A (MANILA BRANCH)
CITIPHMX,CITIPHMXTSU,CITIBANK N.A (MANILA BRANCH)
CITIPHMX,CITIPHMXXXX,CITIBANK N.A (MANILA BRANCH)
CITRPHM1,CITRPHM1XXX,CITYTRUST SECURITIES CORP.
CITSPHM1,CITSPHM1XXX,CITISECURITIES INC.
CIVAPHM1,CIVAPHM1XXX,CITY SAVINGS BANK
CIVVPHM1,CIVVPHM1XXX,"CITYSTATE SAVINGS BANK, INC."
CIYCPHM2,CIYCPHM2XXX,"CIS BAYAD CENTER, INC."
CLRAPH21,CLRAPH21XXX,"CLASSIC RURAL BANK,INC."
CLSAPHM1,CLSAPHM1XXX,"CLSA PHILIPPINES, INC."
CNRLPHM1,CNRLPHM1XXX,"CANTILAN BANK, INC. (A RURAL BANK)"
COBMPHM1,COBMPHM1XXX,BANK OF COMMERCE
COUKPHM1,COUKPHM1XXX,TOP BANK PHILIPPINES INC.
COYAPHM2,COYAPHM2XXX,COOPERATIVE BANK OF CAGAYAN
COYIPHM1,COYIPHM1XXX,COYIUTO SECURITIES INC.
CPBBPHM1,CPBBPHM1XXX,UCPB SECURITIES INC.
CPBOPHM1,CPBOPHM1XXX,COOPERATIVE BANK OF BOHOL
CPCTPHM1,CPCTPHM1XXX,COOPERATIVE BANK OF COTABATO
CPHIPHMM,CPHIPHMMXXX,PHILIPPINE BANK OF COMMUNICATIONS
CRESPHM1,CRESPHM1XXX,CREDIT SUISSE SECURITIES (PHILIPPINES) INC.
CRMHPHM1,CRMHPHM1XXX,"CARD SME BANK, INC. A THRIFT BANK"
CRSEPHM1,CRSEPHM1XXX,CROSBY SECURITIES (PHILS) INC.
CTCBPHMM,CTCBPHMMXXX,CTBC BANK (PHILIPPINES) CORP.
CUASPHM1,CUASPHM1XXX,CUALOPING SECURITIES CORP
CUATPHM1,CUATPHM1XXX,MINDANAO CONSOLIDATED COOPERATIVE BANK
CUOBPHM2,CUOBPHM2XXX,"COMMUNITY RURAL BANK OF ROMBLON (ROMBLON), INC"
DANIPHM1,DANIPHM1XXX,PT BANK DAGANG NASIONAL INDONESIA
DAVSPHM1,DAVSPHM1XXX,DAVID GO SECURITIES CORP
DBPHPHMM,DBPHPHMMXXX,DEVELOPMENT BANK OF THE PHILIPPINES
DBSHPHM1,DBSHPHM1XXX,"DBP-DAIWA CAPITAL MARKETS PHILIPPINES, INC."
DBSPPHM1,DBSPPHM1XXX,DBS SECURITIES (PHILS) INC
DCDEPHM1,DCDEPHM1XXX,"DUMAGUETE CITY DEVELOPMENT BANK,INC"
DCPHPHM1,DCPHPHM1XXX,"DCPAY PHILIPPINES, INC"
DEUTPHMM,DEUTPHMMF4C,DEUTSCHE BANK AG
DEUTPHMM,DEUTPHMMXXX,DEUTSCHE BANK AG
DHBIPHM1,DHBIPHM1XXX,"BDO UNIBANK, INC."
DHSPPHM1,DHSPPHM1XXX,DHARMALA INTL. PHILS. INC.
DIVSPHM1,DIVSPHM1XXX,DIVERSIFIED SECURITIES INC
DSPHPHM1,DSPHPHM1XXX,DBP-DAIWA CAPITAL MARKETS PHILIPPIN INC.
DUMTPHM1,DUMTPHM1XXX,"DUNGGANON BANK (A MICROFINANCE RURAL BANK), INC"
EAGMPHM2,EAGMPHM2XXX,EASYPAY GLOBAL EMI CORP.
EASDPHM1,EASDPHM1XXX,EASTERN SECURITIES DEVELOPMENT CORP
EAWCPHM1,EAWCPHM1XXX,EAST WEST CAPITAL CORP
EAWRPHM2,EAWRPHM2XXX,"EAST WEST RURAL BANK, INC."
ECASPHM2,ECASPHM2XXX,ECASHPAY ASIA INC
EISEPHM1,EISEPHM1XXX,"EIB SECURITIES, INC."
ENRUPHM1,ENRUPHM1XXX,"ENTREPRENEUR RURAL BANK, INC."
ENTHPHM1,ENTHPHM1XXX,ENTERPRISE BANK INC. (A THRIFT BANK)
EQICPHM1,EQICPHM1XXX,SB EQUITIES INCORPORATED
EQSNPHM1,EQSNPHM1XXX,"EQUICOM SAVINGS BANK, INC."
EQSPPHM1,EQSPPHM1XXX,EQUITABLE SECURITIES (PHILS) INC
EQUSPHM1,EQUSPHM1XXX,EQUITIWORLD SECURITIES INC
ESBEPHM1,ESBEPHM1XXX,EVERGREEN STOCK BROKER AND SECURITI ES INC
EWBCPHMM,EWBCPHMMXXX,EAST WEST BANKING CORPORATION
FCBKPHMM,FCBKPHMMXXX,"FIRST COMMERCIAL BANK, LTD., MANILA BRANCH"
FICEPHM1,FICEPHM1XXX,FIRST INTEGRATED CAPITAL SECURITIES INC
FINUPHM1,FINUPHM1XXX,FINVEST SECURITIES CO INC
FIOOPHM1,FIOOPHM1XXX,FIRST CONSOLIDATED BANK INC.
FIOSPHM1,FIOSPHM1XXX,FIRST ORIENT SECURITIES INC
FIRRPHM1,FIRRPHM1XXX,"FIRST RESSOURCES MANAGEMENT AND SEC URITIES CORPORATION,THE"
FMICPHM1,FMICPHM1XXX,FIRST METRO INVESTMENT CORPORATION
FMSOPHM1,FMSOPHM1XXX,FIRST METRO SECURITIES BROKERAGE CORPORATION
FOTRPHM1,FOTRPHM1XXX,FORTUNE SECURITIES INC
FRARPHM1,FRARPHM1XXX,"FIRST AGRO-INDUSTRIAL RURAL BANK, INC. (FAIRBANK)"
FROEPHM1,FROEPHM1XXX,FRANCISCO ORTIGAS SECURITIES INC
FRUNPHM1,FRUNPHM1XXX,"FILIDIAN RURAL BANK OF ANTIPOLO, INC"
GARKPHM1,GARKPHM1XXX,"GATEWAY RURAL BANK, INC. (GATEBANK)"
GEGSPHM1,GEGSPHM1XXX,GENESIS GLOBAL SECURITIES INC
GEMPPH21,GEMPPH21XXX,"GE MONEY BANK, INC. (A SAVINGS BANK)"
GIMSPHM1,GIMSPHM1XXX,"I.B. GIMENEZ SECURITIES, INC."
GKGSPHM1,GKGSPHM1XXX,G.K. GOH SECURITIES (PHILIPPINES) INC.
GLSTPHM1,GLSTPHM1XXX,GLOBALINKS SECURITIES AND STOCKS IN C
GOLCPHM1,GOLCPHM1XXX,GOLDSTAR SECURITIES INC
GOTYPHM2,GOTYPHM2XXX,GOTYME BANK CORPORATION
GPNEPHM2,GPNEPHM2XXX,"GPAY NETWORK PH, INC."
GRBUPHM1,GRBUPHM1XXX,"GUAGUA RURAL BANK, INC."
GSFAPHM1,GSFAPHM1XXX,GSIS FAMILY BANK
GUISPHM1,GUISPHM1XXX,GUILD SECURITIES INC
GUSPPHM1,GUSPPHM1XXX,GUOCO SECURITIES (PHILS) INC
GXCHPHM2,GXCHPHM2XXX,"G-XCHANGE, INC."
HDISPHM1,HDISPHM1XXX,HDI SECURITIES INC
HENEPHM1,HENEPHM1XXX,YU HENG SECURITIES INC.
HISHPHM1,HISHPHM1XXX,HIGHLAND SECURITIES PHIL. INC.
HIYCPHM1,HIYCPHM1XXX,HIYAS BANKING CORPORATION
HNBKPHMM,HNBKPHMMXXX,"HUA NAN COMMERCIAL BANK, LTD. MANILA BRANCH"
HSBCPHMM,HSBCPHMMCEB,THE HONGKONG AND SHANGHAI BANKING CORPORATION LTD - PHILIPPINE BRANCH
HSBCPHMM,HSBCPHMMSEC,THE HONGKONG AND SHANGHAI BANKING CORPORATION LTD - PHILIPPINE BRANCH
HSBCPHMM,HSBCPHMMTRY,THE HONGKONG AND SHANGHAI BANKING CORPORATION LTD - PHILIPPINE BRANCH
HSBCPHMM,HSBCPHMMXXX,THE HONGKONG AND SHANGHAI BANKING CORPORATION LTD - PHILIPPINE BRANCH
IBKOPHMM,IBKOPHMMXXX,"INDUSTRIAL BANK OF KOREA, MANILA BRANCH"
ICBCPHMM,ICBCPHMMXXX,"MEGA INTERNATIONAL COMMERCIAL BANK CO., LTD."
ICBKPHMM,ICBKPHMMXXX,"INDUSTRIAL AND COMMERCIAL BANK OF CHINA LIMITED, MANILA BRANCH"
IFIPPHM2,IFIPPHM2XXX,INFOSERVE INCORPORATED
IGCSPHM1,IGCSPHM1XXX,IGC SECURITIES INC
ILSTPHM1,ILSTPHM1XXX,CITIBANK SAVINGS INC
IMGAPHM1,IMGAPHM1XXX,"IMPERIAL DE GUZMAN, ABALOS AND CO I NC."
INBLPHM1,INBLPHM1XXX,MACQUARIE SECURITIES (PHILIPPINES) INC.
INGBPHMM,INGBPHMMXXX,ING BANK N.V.
INIEPHM1,INIEPHM1XXX,INTRA-INVEST SECURITIES INC
INVUPHM1,INVUPHM1XXX,INVESTORS SECURITIES INC
IORUPHM1,IORUPHM1XXX,"INNOVATIVE BANK, INC. (A RURAL BANK)"
IREMPHM2,IREMPHM2XXX,"I-REMIT, INC."
ISTHPHM1,ISTHPHM1XXX,"ISLA BANK (A THRIFT BANK), INC."
ITDEPHM2,ITDEPHM2XXX,INTER-ASIA DEVELOPMENT BANK
JARUPHM1,JARUPHM1XXX,"JANIUAY RURAL BANK, INC."
KACUPHM2,KACUPHM2XXX,KATIPUNAN BANKING CORPORATION 'A RURAL BANK'
KARUPHM1,KARUPHM1XXX,BANGKO KABAYAN (A RURAL BANK) INC.
KEYSPHM1,KEYSPHM1XXX,KEY SECURITIES INC
KMESPHM1,KMESPHM1XXX,"MAYBANK ATR KIM ENG SECURITIES, INC."
KOEXPHMM,KOEXPHMMXXX,"KEB HANA BANK, MANILA BRANCH"
KRBFPHM1,KRBFPHM1XXX,"KATIPUNAN BANK (ZN), INC. A RURAL BANK"
LARCPHM1,LARCPHM1XXX,LARRGO SECURITIES CO INC
LAUIPHM2,LAUIPHM2XXX,MARIBANK PHILIPPINES INC (A RURAL BANK)
LESIPHM1,LESIPHM1XXX,LEGAZPI SAVINGS BANK
LFSHPHM2,LFSHPHM2XXX,LULU FINANCIAL SERVICES (PHILS) INC
LILOPHM1,LILOPHM1XXX,"RURAL BANK OF LILOY (ZN), INC"
LIMSPHM1,LIMSPHM1XXX,R.S. LIM AND CO. INC.
LIRAPHM2,LIRAPHM2XXX,LIFEBANK-A RURAL BANK
LIRRPHM1,LIRRPHM1XXX,LIMCOMA RURAL BANK INC.
LIRUPHM1,LIRUPHM1XXX,LIPA BANK INC. -A RURAL BANK
LITSPHM1,LITSPHM1XXX,LITONJUA SECURITIES INC
LOLLPHM1,LOLLPHM1XXX,"LOPEZ, LOCSIN, LEDESMA AND CO INC"
LOLPPHM2,LOLPPHM2XXX,LOLC BANK PHILIPPINES INC
LPCRPHM2,LPCRPHM2XXX,LAGUNA PRESTIGE BANKING CORPORATION A RURAL BANK
LUCSPHM1,LUCSPHM1XXX,LUCKY SECURITIES INC
LUDVPHM1,LUDVPHM1XXX,LUZON DEVELOPMENT BANK
LURRPHM2,LURRPHM2XXX,"GM BANK OF LUZON, INC. (A RURAL BANK)"
LUYSPHM1,LUYSPHM1XXX,LUY'S SECURITIES CO INC
MAARPHM1,MAARPHM1XXX,MALAYAN BANK SAVINGS AND MORTGAGE 2ND FLOOR
MABCPHM1,MABCPHM1XXX,MANILA BANKING CORP.
MAIEPHM1,MAIEPHM1XXX,MARIAN SECURITIES INC
MAKCPHM1,MAKCPHM1XXX,MARK SECURITIES CORP
MANUPHM1,MANUPHM1XXX,MANDARIN SECURITIES CORP
MAYCPHM2,MAYCPHM2XXX,MARCOPAY INC.
MBBEPHMM,MBBEPHMMXXX,"MAYBANK PHILIPPINES, INC"
MBTCPHMM,MBTCPHMMXXX,METROPOLITAN BANK AND TRUST COMPANY
MCCEPHM1,MCCEPHM1XXX,METROBANK CARD CORPORATION (A FINANCE CO.)
MCRUPHM1,MCRUPHM1XXX,"1ST MACRO BANK, INC. (A RURAL BANK)"
MDRSPHM1,MDRSPHM1XXX,MDR SECURITIES INC
MEOPPHM2,MEOPPHM2XXX,METRO SOUTH COOPERATIVE BANK
MERTPHM1,MERTPHM1XXX,MERIDIAN SECURITIES INC
MERUPHM1,MERUPHM1XXX,MERCANTILE SECURITIES CORP
MFCTPHMM,MFCTPHMMXXX,"THE MANUFACTURERS LIFE INSURANCE CO. (PHILS.), INC."
MGPSPHM1,MGPSPHM1XXX,"DEUTSCHE REGIS PARTNERS, INC."
MHCBPHMM,MHCBPHMMXXX,"MIZUHO BANK, LTD. MANILA BRANCH"
MIMVPHM1,MIMVPHM1XXX,"MICROFINANCE MAXIMUM SAVINGS BANK,INC."
MIOCPHM1,MIOCPHM1XXX,MINDANAO CONSOLIDATED COOPERATIVE BANK
MKDCPHM2,MKDCPHM2XXX,MAKILING DEVELOPMENT BANK CORPORATION
MKRUPHM1,MKRUPHM1XXX,"BANK OF MAKATI (A SAVINGS BANK), INC."
MLRUPHM2,MLRUPHM2XXX,"MALARAYAT RURAL BANK, INC."
MLSPPHM1,MLSPPHM1XXX,MERRILL LYNCH SECURITIES PHILIPPINES INC.
MOMLPHM2,MOMLPHM2XXX,"MONEY MALL RURAL BANK, INC."
MOPSPHM1,MOPSPHM1XXX,MOUNT PEAK SECURITIES INC
MOUAPHM2,MOUAPHM2XXX,"BANGKO MONTANOSA, INC. A RURAL BANK"
MRLCPHM2,MRLCPHM2XXX,MACTAN RURAL BANK (LAPU-LAPU CITY) INC
MRTCPHM1,MRTCPHM1XXX,"BANGKO MABUHAY (A RURAL BANK), INC."
MSLSPHM1,MSLSPHM1XXX,"MERCHANTS SAVINGS AND LOAN ASSOCIATION, INC."
MUIAPHM1,MUIAPHM1XXX,MULTINATIONAL INVESTMENT BANCORPORATION
MURLPHM1,MURLPHM1XXX,"MUNICIPAL RURAL BANK OF LIBMANAN (CS), INC."
MVRSPHM2,MVRSPHM2XXX,MVSM BANK (A RURAL BANK SINCE 1953)
MYYAPHM2,MYYAPHM2XXX,"MAYA BANK, INC."
NEWCPHM1,NEWCPHM1XXX,NEW WORLD SECURITIES CO INC
NIESPHM1,NIESPHM1XXX,NIEVES SANCHEZ INC.
NODVPHM1,NODVPHM1XXX,"NORTHPOINT DEVELOPMENT BANK, INC."
NRSLPHM1,NRSLPHM1XXX,NEW RURAL BANK OF SAN LEONARDO (NE) INC.
NSPRPHM1,NSPRPHM1XXX,BANGKO NUESTRA SENORA DEL PILAR INC. (A RURAL BANK)
NUBLPHM1,NUBLPHM1XXX,R. NUBLA SECURITIES INC.
OMLFPHM1,OMLFPHM1XXX,ORIX METRO LEASING AND FINANCE CORPORATION
OMNPPHM2,OMNPPHM2XXX,"OMNIPAY, INC."
ONNRPHM1,ONNRPHM1XXX,"BDO NETWORK BANK, INC. (A RURAL BANK)"
ONSTPHM1,ONSTPHM1XXX,BANK ONE SAVINGS AND TRUST CORP.
OPDVPHM1,OPDVPHM1XXX,OPTIMUM DEVELOPEMENT BANK. INC
OPTMPHM1,OPTMPHM1XXX,OPTIMUM SECURITIES CORP.
ORIEPHM1,ORIEPHM1XXX,ORIENTRADE SECURITIES INC.
ORMQPHM1,ORMQPHM1XXX,ORMON BANK RB OF MULANAY QUEZON INC.
ORSIPHM1,ORSIPHM1XXX,"BANCO DE ORO SAVINGS BANK, INC."
OSPNPHM1,OSPNPHM1XXX,OCBC SECURITIES (PHILIPPINES) INC. CENTRE EAST TOWER EXCHANGE ROAD
OUBKPHM1,OUBKPHM1XXX,"OVERSEAS UNION BANK LTD, MANILA BR."
OWNOPHM2,OWNOPHM2XXX,OWN BANK THE RURAL BANK OF CAVITE CITY INC.
PABIPHMM,PABIPHMMXXX,BANK OF COMMERCE
PAEYPHM2,PAEYPHM2XXX,"PAYMONGO PAYMENTS, INC."
PAHCPHM2,PAHCPHM2XXX,PAYNAMICS TECHNOLOGIES INC
PANIPHM1,PANIPHM1XXX,PAN ASIA SECURITIES CORP.
PAPDPHM1,PAPDPHM1XXX,"THE PALAWAN BANK (PALAWAN DEVELOPMENT BANK, INC.)."
PAPHPHM1,PAPHPHM1XXX,PAYMAYA PHILIPPINES INC.
PAPSPHM1,PAPSPHM1XXX,PAPA SECURITIES CORP.
PASVPHM1,PASVPHM1XXX,PACIFIC ACE SAVINGS BANK
PATPPHM1,PATPPHM1XXX,PACIFIC ASIAN ATLANTIC CAPITAL INC.
PCHCPHM1,PCHCPHM1XXX,PHILIPPINE CLEARING HOUSE CORPORATION
PDAXPHM2,PDAXPHM2XXX,"PHILIPPINE DIGITAL ASSET EXCHANGE, INC. (PDAX)"
PDTCPHM1,PDTCPHM1XXX,PHILIPPINE DEPOSITORY AND TRUST CORPORATION
PDTDPHM1,PDTDPHM1XXX,PHILIPPINE DEPOSITORY AND TRUST CORP. (DEPOSITORY)
PDTUPHM1,PDTUPHM1XXX,PHILIPPINE DEPOSITORY AND TRUST CORP. (CUSTODY)
PEBZPHM2,PEBZPHM2XXX,PEPPERMINT BIZMOTO INC.
PEPDPHM1,PEPDPHM1XXX,PENBANK A PRIVATE DEVELOPMENT BANK
PEQPPHM1,PEQPPHM1XXX,PHILIPPINE EQUITY PARTNERS INC.
PESPPHM1,PESPPHM1XXX,"MAYBANK ATR KIM ENG SECURITIES, INC."
PHCBPHMA,PHCBPHMAXXX,BANGKO SENTRAL NG PILIPINAS
PHCBPHMM,PHCBPHMMXXX,BANGKO SENTRAL NG PILIPINAS
PHCCPHM1,PHCCPHM1XXX,"PHILIPPINE COMMERCIAL CAPITAL, INC."
PHCDPHM1,PHCDPHM1XXX,PHILIPPINE DEPOSITORY AND TRUST CORP
PHSAPHM1,PHSAPHM1XXX,EAST WEST BANKING CORPORATION
PHSBPHMM,PHSBPHMMXXX,PHILIPPINE SAVINGS BANK
PHSVPHM1,PHSVPHM1XXX,"OVERSEAS FILIPINO BANK, INC"
PHTBPHMM,PHTBPHMMXXX,PHILTRUST BANK (PHILIPPINE TRUST COMPANY)
PHVBPHMM,PHVBPHMMXXX,PHILIPPINE VETERANS BANK
PIEIPHM1,PIEIPHM1XXX,PIERCE INTERLINK SEC. INC.
PLAIPHM1,PLAIPHM1XXX,PLATINUM SECURITIES INC.
PNBBPHM1,PNBBPHM1XXX,PNB SECURITIES INC.
PNBMPHMM,PNBMPHMMTOD,PHILIPPINE NATIONAL BANK
PNBMPHMM,PNBMPHMMXXX,PHILIPPINE NATIONAL BANK
PNSAPHM1,PNSAPHM1XXX,PNB SAVINGS BANK
POUAPHM2,POUAPHM2XXX,PROVIDENCE RURAL BANK INC.
PPBUPHMM,PPBUPHMMXXX,"PHILIPPINE BUSINESS BANK, INC., A SAVINGS BANK"
PPOSPHM1,PPOSPHM1XXX,PHILIPPINE POSTAL CORPORATION
PPSFPHM2,PPSFPHM2XXX,PPS-PEPP FINANCIAL SERVICES CORPORATION
PRBPPH21,PRBPPH21XXX,"PRIME MEDIA HOLDINGS, INC."
PRBPPHM1,PRBPPHM1XXX,"PRIME MEDIA HOLDINGS, INC."
PRDEPHM1,PRDEPHM1XXX,PREMIERE DEVELOPMENT BANK
PREMPHM1,PREMPHM1XXX,"PREMIUM SECURITIES, INC."
PRNPPHM1,PRNPPHM1XXX,"PLANBANK RURAL BANK OF CANLUBANG PLANTERS, INC."
PROTPHM1,PROTPHM1XXX,PROBITY SECURITIES MANAGEMENT CORP.
PRTOPHM1,PRTOPHM1XXX,"PARTNER RURAL BANK (COTABATO), INC."
PSBOPHM1,PSBOPHM1XXX,PCCI SECURITIES BROKERS CORPORATION
PSCOPHM1,PSCOPHM1XXX,PRODUCERS SAVINGS BANK CORPORATION
PUBLPHM1,PUBLPHM1XXX,SALISBURY BKT SECURITIES CORP. (FORM: PUBLIC SECURITIES CORP.
QCDFPHM1,QCDFPHM1XXX,QUEEN CITY DEVELOPMENT BANK 5TH FLOOR
QCRIPHM1,QCRIPHM1XXX,"QUEZON CAPITAL RURAL BANK, INCORPORATED"
QUISPHM1,QUISPHM1XXX,QUALITY INVESTMENT AND SECURITIES C ORP.
QWBSPHM2,QWBSPHM2XXX,QWIKWIRE BILLING SYSTEMS INC
RARLPHM1,RARLPHM1XXX,"RANG-AY BANK (A RURAL BANK), INC."
RBCYPHM1,RBCYPHM1XXX,RURAL BANK OF CAUAYAN INC.
RBRUPHM2,RBRUPHM2XXX,"RBT BANK, INC., A RURAL BANK"
RCBCPH21,RCBCPH21XXX,RIZAL COMMERCIAL BANKING CORPORATION
RCBCPHMM,RCBCPHMMXXX,RIZAL COMMERCIAL BANKING CORP.
RCCOPHM1,RCCOPHM1XXX,RCBC CAPITAL CORPORATION
RCSAPHM1,RCSAPHM1XXX,"RCBC SAVINGS BANK, INC."
REGIPHM1,REGIPHM1XXX,REGINA CAPITAL DEVELOPMENT CORP.
RETHPHM1,RETHPHM1XXX,"BDO UNIBANK, INC."
RFCAPHM1,RFCAPHM1XXX,RFM CAPITAL LIMITED
RLSKPHM1,RLSKPHM1XXX,RURAL BANK OF LEBAK (SULTAN KUDARAT) INC.
RLSUPHM2,RLSUPHM2XXX,"RURAL BANK OF LANUZA (SURIGAO DEL SUR), INC."
RNWAPHM1,RNWAPHM1XXX,RURAL BANK OF NEW WASHINGTON (AKLAN) INC.
ROBPPHMQ,ROBPPHMQXXX,BANK OF THE PHILIPPINE ISLANDS
RPBAPHM1,RPBAPHM1XXX,"MAYBANK PHILIPPINES, INC"
RPBUPHM1,RPBUPHM1XXX,"RURAL BANK OF PANDI (BULACAN), INC."
RPMOPHM1,RPMOPHM1XXX,RURAL BANK OF PANA-ON (MIS. OCC.) INC.
RSJCPHM1,RSJCPHM1XXX,"RURAL BANK OF SAN JOSE (CAMARINES SUR), INC."
RSLSPHM1,RSLSPHM1XXX,"RURAL BANK OF SAN LUIS (BATANGAS), INC."
RSMCPHM2,RSMCPHM2XXX,RURAL BANK OF SANCHEZ MIRA CAGAYAN INC.
RSMSPHM2,RSMSPHM2XXX,RURAL BANK OF SAN MATEO (ISABELA) INC
RSNAPHM2,RSNAPHM2XXX,"RURAL BANK OF SAN NARCISO, INC."
RTGCPHM1,RTGCPHM1XXX,RTG AND CO. INC.
RUANPH22,RUANPH22XXX,"RURAL BANK OF ANGELES, INC."
RUATPHM1,RUATPHM1XXX,"RURAL BANK OF ATIMONAN, INC."
RUBCPHM2,RUBCPHM2XXX,"RURAL BANK OF BACOLOD CITY, INC."
RUBTPHM2,RUBTPHM2XXX,"SUMMIT BANK (RURAL BANK OF TUBLAY, INC.)"
RUBUPHM2,RUBUPHM2XXX,RURAL BANK OF BAUANG INC
RUBYPHM2,RUBYPHM2XXX,"RURAL BANK OF BAY, INC."
RUCAPHM1,RUCAPHM1XXX,CAMALIG BANK INC. (A RURAL BANK)
RUDIPHM1,RUDIPHM1XXX,"RURAL BANK OF DIGOS, INC"
RUGUPHM1,RUGUPHM1XXX,"RURAL BANK OF GUINOBATAN, INC."
RUHLPHM2,RUHLPHM2XXX,"RURAL BANK OF HILONGOS (LEYTE), INC"
RUIEPHM2,RUIEPHM2XXX,"RURAL BANK OF ITOGON (BENGUET), INC"
RUJAPHM1,RUJAPHM1XXX,"RURAL BANK OF JAEN, INC."
RUKBPHM1,RUKBPHM1XXX,"RURAL BANK OF KIBAWE (BUKIDNON),INC"
RUKSPHM1,RUKSPHM1XXX,RURAL BANK OF KIAMBA (SARANGANI) INC.
RUMAPHM1,RUMAPHM1XXX,"RURAL BANK OF MABALACAT, INC."
RUMDPHM1,RUMDPHM1XXX,"RURAL BANK OF MIDSAYAP, INC."
RUMIPHM1,RUMIPHM1XXX,"RURAL BANK OF MIAGAO (ILOILO), INC."
RUMNPHM1,RUMNPHM1XXX,"RURAL BANK OF MANGALDAN, INC."
RUMTPHM2,RUMTPHM2XXX,"RURAL BANK OF MONTALBAN, INC."
RUODPHM1,RUODPHM1XXX,MANOR BANK - A RURAL BANK CORP
RUPAPHM1,RUPAPHM1XXX,RURAL BANK OF PAGBILAO INC.
RUPIPHM1,RUPIPHM1XXX,BANGKO RURAL NG PASACAO (CAMARINES SUR) INC
RUPPPHM2,RUPPPHM2XXX,"RURAL BANK OF PORAC (PAMP), INC."
RUPZPHM2,RUPZPHM2XXX,"RURAL BANK OF LA PAZ, INC."
RURLPHM2,RURLPHM2XXX,"BANKWAYS, INC. (A RURAL BANK)"
RURUPHM2,RURUPHM2XXX,RURAL BANK OF ROSARIO (LA UNION)INC
RUSGPHM1,RUSGPHM1XXX,"RURAL BANK OF STA. IGNACIA, INC."
RUSNPHM2,RUSNPHM2XXX,"RURAL BANK OF SOLANO (N.V.),INC."
RUSTPHM2,RUSTPHM2XXX,"RURAL BANK OF SILAY CITY, INC."
RUSYPHM2,RUSYPHM2XXX,"RURAL BANK OF SAGAY, INC."
RUTCPHM1,RUTCPHM1XXX,RURAL BANK OF TANGUB CITY INC.
RUTNPHM1,RUTNPHM1XXX,"RURAL BANK OF TANJAY, INC."
SAPPPHM1,SAPPPHM1XXX,SAPPHIRE SECURITIES INC.
SAUAPHM1,SAUAPHM1XXX,"SAVIOUR RURAL BANK, INC."
SAVRPHM1,SAVRPHM1XXX,"BANCO SAN VICENTE, INC. (A RURAL BANK)"
SCBLPHMM,SCBLPHMMEQI,STANDARD CHARTERED BANK
SCBLPHMM,SCBLPHMMXXX,STANDARD CHARTERED BANK
SCUAPHM2,SCUAPHM2XXX,"SOUTHEAST COUNTRY BANK, INC. (A RURAL BANK)"
SECLPHM1,SECLPHM1XXX,SECURITIES SPECIALISTS INC.
SERTPHM1,SERTPHM1XXX,G AND L SECURITIES CO INC
SETCPHMM,SETCPHMMXXX,SECURITY BANK CORPORATION
SEUUPHM1,SEUUPHM1XXX,A AND A SECURITIES INC.
SGSEPHM1,SGSEPHM1XXX,"SG SECURITIES (PHILIPPINES),INC."
SHBKPHMM,SHBKPHMMXXX,SHINHAN BANK MANILA BRANCH
SHPHPHM2,SHPHPHM2XXX,"SHOPEEPAY PHILIPPINES, INC."
SJROPHM1,SJROPHM1XXX,S.J. ROXAS AND CO. INC.
SLRNPHM2,SLRNPHM2XXX,SALMON BANK (RURAL BANK) INC.
SMBCPHMM,SMBCPHMMXXX,SUMITOMO MITSUI BANKING CORPORATION MANILA BRANCH
SOLRPHM1,SOLRPHM1XXX,SOLAR SECURITIES INC.
SOTTPHM1,SOTTPHM1XXX,SOUTH BANK INC
SPEYPHM2,SPEYPHM2XXX,SPEEDYPAY INC.
SRCPPHM2,SRCPPHM2XXX,STARPAY CORPORATION
SRLCPHM1,SRLCPHM1XXX,"SUMMIT RURAL BANK OF LIPA CITY, INC"
SSSTPHM1,SSSTPHM1XXX,SYSTEMS STANDARDS INC.
STACPHM1,STACPHM1XXX,STANDARD SECURITIES CORP.
STIUPHM1,STIUPHM1XXX,"STATE INVESTMENT TRUST, INC."
STLAPH22,STLAPH22XXX,STERLING BANK OF ASIA INC. (A SAVINGS BANK)
SUIRPHM1,SUIRPHM1XXX,SQUIRE SECURITIES INC.
SUMMPHM1,SUMMPHM1XXX,SUMMIT SECURITIES INC.
SUPMPHM1,SUPMPHM1XXX,SUPREME STOCKBROKER INC.
SUSVPHM1,SUSVPHM1XXX,SUN SAVINGS BANK
SWDEPHM1,SWDEPHM1XXX,UBS SECURITIES PHILIPPINES INC
TACBPHMM,TACBPHMMXXX,TAIWAN COOPERATIVE BANK MANILA OFFSHORE BANKING BRANCH
TAGCPHM2,TAGCPHM2XXX,TAGCASH LTD. INC.
TANGPHM1,TANGPHM1XXX,TANSENGCO AND COMPANY INC.
TANNPHM1,TANNPHM1XXX,G.D. TAN AND CO INC
TAYOPHM2,TAYOPHM2XXX,TAYOCASH INC.
TFSHPHM1,TFSHPHM1XXX,"TOYOTA FINANCIAL SERVICES PHILIPPINES, CORP."
TIOCPHM1,TIOCPHM1XXX,UY-TIOCO AND CO. INC.
TLBPPHM1,TLBPPHM10M2,LAND BANK OF THE PHILIPPINES
TLBPPHM1,TLBPPHM10M3,LAND BANK OF THE PHILIPPINES
TLBPPHM1,TLBPPHM10M4,LAND BANK OF THE PHILIPPINES
TLBPPHM1,TLBPPHM10MC,LAND BANK OF THE PHILIPPINES
TLBPPHM1,TLBPPHM10MQ,LAND BANK OF THE PHILIPPINES
TLBPPHMM,TLBPPHMMXXX,LAND BANK OF THE PHILIPPINES
TODGPHM2,TODGPHM2XXX,"TONIK DIGITAL BANK, INC."
TOKTPHM2,TOKTPHM2XXX,TOKTOKWALLET INC.
TOPJPHM2,TOPJPHM2XXX,TOPJUAN TECH CORPORATION
TOWRPHM1,TOWRPHM1XXX,TOWER SECURITIES INC.
TRAAPHM1,TRAAPHM1XXX,TRANS-ASIA SECURITIES INC.
TRBFPHM1,TRBFPHM1XXX,TRADERS ROYAL BANK
TRENPHM1,TRENPHM1XXX,TRENDLINE SECURITIES CORP.
TRITPHM1,TRITPHM1XXX,TRI-STATE SECURITIES INC.
TRULPHM1,TRULPHM1XXX,"TIAONG RURAL BANK, INC."
TRWIPHM2,TRWIPHM2XXX,WISE PILIPINAS INC.
TRXPPHM2,TRXPPHM2XXX,TRAXION PAY INC
TWENPHM1,TWENPHM1XXX,"DEUTSCHE REGIS PARTNERS, INC"
TYBKPHMM,TYBKPHMMXXX,"YUANTA SAVINGS BANK PHILIPPINES, INC."
UBPHPHMM,UBPHPHMMXXX,UNION BANK OF THE PHILIPPINES
UBPPPHM1,UBPPPHM1XXX,UBP SECURITIES INC.
UCSEPHM1,UCSEPHM1XXX,UNICAPITAL SECURITIES INC.
UCSVPHM1,UCSVPHM1XXX,"UCPB SAVINGS BANK, INC."
UKHCPHM1,UKHCPHM1XXX,"UOB KAY HIAN SECURITIES(PHILS.),INC"
UNOBPHM2,UNOBPHM2XXX,UNOBANK INC.
UNODPHM2,UNODPHM2XXX,UNIONDIGITAL BANK INC.
UOVBPHMM,UOVBPHMMXXX,UNITED OVERSEAS BANK LIMITED - MANILA BRANCH
USMEPHM2,USMEPHM2XXX,USSC MONEY SERVICES INC
UWCBPHMM,UWCBPHMMXXX,"CATHAY UNITED BANK CO., LTD MANILA BRANCH"
VADVPHM1,VADVPHM1XXX,"1ST VALLEY BANK INC., A DEVELOPMENT BANK"
VENTPHM1,VENTPHM1XXX,VENTURE SECURITIES INC.
VGBCPHM1,VGBCPHM1XXX,VIGAN BANCO RURAL INCORPORADA
VICAPHM1,VICAPHM1XXX,VICSAL SECURITIES AND STOCKS BROKERAGE INC
VICGPHM1,VICGPHM1XXX,VICENTE GOQUIOLAY AND CO. INC.
WEASPHM1,WEASPHM1XXX,WEALTH SECURITIES INC
WEDVPHM1,WEDVPHM1XXX,WEALTH DEVELOPMENT BANK
WERAPHM2,WERAPHM2XXX,"WELCOME BANK, RURAL BANK INC."
WICAPHM1,WICAPHM1XXX,INDOSUEZ W.I. CARR SECURITIES (PHILIPPINES) INC.
WISPPHM1,WISPPHM1XXX,WORLDSEC INTERNATIONAL SECURITIES PHILIPPINES INC
WOLFPHM1,WOLFPHM1XXX,WOLFF AND CO INC.
WONGPHM1,WONGPHM1XXX,WONG SECURITIES CORP.
WOPAPHM1,WOPAPHM1XXX,WORLD PARTNERS BANK
XPHSPHM1,XPHSPHM1XXX,"PHILIPPINE STOCK EXCHANGE, INC."
YAOZPHM1,YAOZPHM1XXX,YAO AND ZIALCITA INC.
YAPSPHM1,YAPSPHM1XXX,F. YAP SECURITIES INC
YAPTPHM1,YAPTPHM1XXX,YAPTINCHAY SEC. INC.
YUOYPHM1,YUOYPHM1XXX,YU AND COMPANY INC.
ZACRPHM1,ZACRPHM1XXX,"ZAMBOANGA CITY RURAL BANK, INC."
ZARUPHM1,ZARUPHM1XXX,"ZAMBALES RURAL BANK, INC."
ZBTEPHM2,ZBTEPHM2XXX,ZYBI TECH INC.
