bic_8,bic,bank
ABFUMYK1,ABFUMYK1XXX,ABRAR FUTURES SDN BHD
ACFBMYK1,ACFBMYK1XXX,AFFIN BANK BERHAD
AEAMMYK1,AEAMMYK1XXX,MAYBANK INVESTMENT BANK BERHAD
AFBQMYKL,AFBQMYKLXXX,MBSB BANK BERHAD
AFIDMYK1,AFIDMYK1XXX,AFFIN HWANG INVESTMENT BANK BERHAD
AFOBMYK1,AFOBMYK1XXX,AMANAH FUTURES AND OPTIONS SDN BHD
AFUOMYK1,AFUOMYK1XXX,AFFIN HWANG INVESTMENT BANK BERHAD
AGISMYK1,AGISMYK1XXX,BANK PERTANIAN MALAYSIA BERHAD
AGOBMY21,AGOBMY21XXX,BANK PERTANIAN MALAYSIA BERHAD- AGROBANK
AGOBMYKL,AGOBMYKLXXX,BANK PERTANIAN MALAYSIA BERHAD- AGROBANK
AIACMYK1,AIACMYK1GIO,AIA BHD.
AIACMYKL,AIACMYKLXXX,AIA BHD.
AIBBMYKL,AIBBMYKLXXX,AFFIN ISLAMIC BANK BERHAD
AIBEMYK1,AIBEMYK1XXX,AIA BERHAD
AINEMY22,AINEMY22XXX,ASIA NEXUS INVESTMENT BANK LTD
AIPMMYK1,AIPMMYK1XXX,AIA PENSION AND ASSET MANAGEMENT SDN BHD
AISLMYKL,AISLMYKLXXX,AMBANK ISLAMIC BERHAD
ALOSMY21,ALOSMY21XXX,ALLIANCE INVESTMENT BANK BERHAD
ALSRMYKL,ALSRMYKLXXX,ALLIANCE ISLAMIC BANK BERHAD
AMBMMYK1,AMBMMYK1XXX,AMANAH BUTLER MALAYSIA SDN BHD
AMCBMYK1,AMCBMYK1XXX,AMCARD SERVICES BERHAD
AMFBMYK1,AMFBMYK1XXX,ARAB MALAYSIAN FINANCE BERHAD
AMMBMY21,AMMBMY21XXX,AMINVESTMENT BANK BERHAD
AMMBMYKL,AMMBMYKLXXX,AMINVESTMENT BANK BERHAD
AMMEMYK1,AMMEMYK1XXX,AMFUNDS MANAGEMENT BERHAD
AMSDMYK1,AMSDMYK1XXX,AMINVESTMENT BANK BERHAD
AMTBMYK1,AMTBMYK1XXX,AMANAHRAYA TRUSTEES BERHAD
AMTBMYKL,AMTBMYKLXXX,AMANAHRAYA TRUSTEES BERHAD
AMUTMYK1,AMUTMYK1XXX,AMFUNDS MANAGEMENT BERHAD
AOFMMYK1,AOFMMYK1XXX,AOF FUTURES SDN. BHD.
APEXMY21,APEXMY21XXX,JF APEX SECURITIES BERHAD
AQINMYK2,AQINMYK2XXX,AQUA INVESTMENT BANK LTD
ARBKMYKL,ARBKMYKLLAB,AMBANK (M) BERHAD
ARBKMYKL,ARBKMYKLXXX,AMBANK (M) BERHAD
ARMDMYK1,ARMDMYK1XXX,AMBANK (M) BERHAD
ASMMMYK1,ASMMMYK1XXX,PMB INVESTMENT BERHAD
ASNCMY2L,ASNCMY2LXXX,ASIA INVESTMENT BANKING CORPORATION
ATBLMY21,ATBLMY21XXX,ASIAN TRADE INVESTMENT BANK LTD
BAHLMY2A,BAHLMY2AXXX,BANK AL HABIB LIMITED
BATSMY21,BATSMY21XXX,BRITISH AMERICAN TOBACCO GSD (KUALA LUMPUR) SDN BHD
BATSMYK1,BATSMYK1XXX,BAT ASPAC SERVICE CENTRE SDN. BHD
BBFTMYK1,BBFTMYK1XXX,BBMB FUTURES SDN BHD
BBUTMYK1,BBUTMYK1XXX,BBMB UNIT TRUST MANAGEMENT BERHAD
BIMBMYKL,BIMBMYKLXXX,BANK ISLAM MALAYSIA BERHAD
BKCHMYKL,BKCHMYKLCLR,BANK OF CHINA (MALAYSIA) BERHAD
BKCHMYKL,BKCHMYKLXXX,BANK OF CHINA (MALAYSIA) BERHAD
BKEWMYK1,BKEWMYK1XXX,BANK MUAMALAT MALAYSIA BERHAD
BKIMMYK1,BKIMMYK1XXX,BANK INDUSTRI MALAYSIA BERHAD
BKKBMYKL,BKKBMYKLXXX,BANGKOK BANK BERHAD
BKRMMYKL,BKRMMYKLXXX,BANK KERJASAMA RAKYAT MALAYSIA BERHAD (BANK RAKYAT)
BMBBMYK1,BMBBMYK1XXX,ALLIANCE INVESTMENT BANK BERHAD
BMDRMYK1,BMDRMYK1XXX,BURSA MALAYSIA DERIVATIVES CLEARING
BMMBMYKL,BMMBMYKLTFD,BANK MUAMALAT MALAYSIA BERHAD
BMMBMYKL,BMMBMYKLXXX,BANK MUAMALAT MALAYSIA BERHAD
BMSCMYK1,BMSCMYK1XXX,BURSA MALAYSIA SECURITIES CLEARING SDN. BHD.
BNMAMY2K,BNMAMY2KXXX,BANK NEGARA MALAYSIA
BNMAMYK3,BNMAMYK3XXX,BANK NEGARA MALAYSIA
BNMAMYKL,BNMAMYKLXXX,BANK NEGARA MALAYSIA
BNPAMY21,BNPAMY21XXX,BNP PARIBAS MALAYSIA BERHAD
BNPAMYKA,BNPAMYKAXXX,BNP PARIBAS
BNPAMYKL,BNPAMYKLSPI,BNP PARIBAS MALAYSIA BERHAD
BNPAMYKL,BNPAMYKLXXX,BNP PARIBAS MALAYSIA BERHAD
BOBEMYK2,BOBEMYK2XXX,BOOST BANK BERHAD
BOFAMY2X,BOFAMY2XGRC,BANK OF AMERICA MALAYSIA BERHAD
BOFAMY2X,BOFAMY2XLBN,BANK OF AMERICA MALAYSIA BERHAD
BOFAMY2X,BOFAMY2XLMY,BANK OF AMERICA MALAYSIA BERHAD
BOFAMY2X,BOFAMY2XXXX,BANK OF AMERICA MALAYSIA BERHAD
BOTKMY21,BOTKMY21XXX,MUFG BANK (MALAYSIA) BERHAD
BOTKMYKA,BOTKMYKAXXX,"MUFG BANK, LTD., LABUAN BRANCH"
BOTKMYKX,BOTKMYKXXXX,MUFG BANK (MALAYSIA) BERHAD
BOTLMY21,BOTLMY21XXX,TA SECURITIES HOLDINGS BERHAD
BPTMMY21,BPTMMY21XXX,CIMB WEALTH ADVISORS BERHAD
BSDBMYK1,BSDBMYK1XXX,BIMB SECURITIES SDN BHD
BSNAMY21,BSNAMY21XXX,BANK SIMPANAN NASIONAL BERHAD
BSNAMYK1,BSNAMYK1XXX,BANK SIMPANAN NASIONAL
BSSBMYK1,BSSBMYK1XXX,BBMB SECURITIES SDN BHD
BUTMMYK1,BUTMMYK1XXX,BIMB INVESTMENT MANAGEMENT BERHAD
CAGAMY21,CAGAMY21XXX,CAGAMAS BERHAD - SPI
CAGAMYKL,CAGAMYKLXXX,CAGAMAS BERHAD
CANHMYKL,CANHMYKLXXX,CIMB-PRINCIPAL ASSET MANAGEMENT BERHAD
CHASMY21,CHASMY21XXX,J.P. MORGAN SECURITIES (MALAYSIA) SDN BHD
CHASMY2A,CHASMY2AXXX,"JPMORGAN CHASE BANK, N.A. - LABUAN BRANCH"
CHASMYKX,CHASMYKXSEC,J.P. MORGAN CHASE BANK BERHAD
CHASMYKX,CHASMYKXXXX,J.P. MORGAN CHASE BANK BERHAD
CHASMYL1,CHASMYL1XXX,J.P. MORGAN CHASE BANK BERHAD
CIBBMY2L,CIBBMY2LXXX,"CIMB BANK BERHAD, LABUAN OFFSHORE BRANCH"
CIBBMYKA,CIBBMYKAXXX,CIMB BANK (L) LIMITED
CIBBMYKL,CIBBMYKLSBL,CIMB BANK BERHAD
CIBBMYKL,CIBBMYKLXXX,CIMB BANK BERHAD
CIMFMYK1,CIMFMYK1XXX,CIMB FUTURES SDN BHD
CINBMY21,CINBMY21XXX,CAPITAL INVESTMENT BANK (LABUAN) LIMITED (CIB LABUAN)
CITIMY21,CITIMY21XXX,CITIGROUP GLOBAL MARKET MALAYSIA SDN BHD
CITIMYKL,CITIMYKLCTI,CITIBANK BERHAD
CITIMYKL,CITIMYKLJOD,CITIBANK BERHAD
CITIMYKL,CITIMYKLLAB,CITIBANK BERHAD
CITIMYKL,CITIMYKLPEN,CITIBANK BERHAD
CITIMYKL,CITIMYKLXXX,CITIBANK BERHAD
CITIMYM1,CITIMYM1XXX,CITIBANK BERHAD
CLSAMYK1,CLSAMYK1XXX,CLSA SECURITIES MALAYSIA SDN. BHD.
COIMMY21,COIMMY21XXX,CIMB INVESTMENT BANK BERHAD
COIMMYKL,COIMMYKLXXX,CIMB INVESTMENT BANK BERHAD
CRESMYKL,CRESMYKLXXX,CREDIT SUISSE SECURITIES (MALAYSIA) SDN. BHD.
CSFBMYK1,CSFBMYK1XXX,CREDIT SUISSE SECURITIES (MALAYSIA) SDN. BHD.
CSMSMYK1,CSMSMYK1XXX,CLSA SECURITIES MALAYSIA SDN. BHD
CTBBMYKL,CTBBMYKLXXX,CIMB ISLAMIC BANK BERHAD
DAICMYK1,DAICMYK1XXX,THE DAIWA SECURITIES INTERNATIONAL (H.K.) LTD
DBSSMY2A,DBSSMY2AXXX,"DBS BANK LTD, LABUAN BRANCH"
DEUTMY21,DEUTMY21XXX,DEUTSCHE BANK (MALAYSIA) BERHAD
DEUTMYKL,DEUTMYKLBLB,DEUTSCHE BANK (MALAYSIA) BERHAD
DEUTMYKL,DEUTMYKLDFS,DEUTSCHE BANK (MALAYSIA) BERHAD
DEUTMYKL,DEUTMYKLF4C,DEUTSCHE BANK (MALAYSIA) BERHAD
DEUTMYKL,DEUTMYKLF4R,DEUTSCHE BANK (MALAYSIA) BERHAD
DEUTMYKL,DEUTMYKLGMO,DEUTSCHE BANK (MALAYSIA) BERHAD
DEUTMYKL,DEUTMYKLIBW,DEUTSCHE BANK (MALAYSIA) BERHAD
DEUTMYKL,DEUTMYKLISB,DEUTSCHE BANK (MALAYSIA) BERHAD
DEUTMYKL,DEUTMYKLXXX,DEUTSCHE BANK (MALAYSIA) BERHAD
ECMLMYKL,ECMLMYKLXXX,KENANGA INVESTMENT BANK BERHAD
ESSHMYK1,ESSHMYK1XXX,EONCAP SECURITIES SDN BHD
EUIEMY22,EUIEMY22XXX,EUROPE-ASIA INVESTMENT BANK LIMITED
EXMBMY21,EXMBMY21XXX,EXPORT-IMPORT BANK OF MALAYSIA BERHAD
EXMBMYKL,EXMBMYKLXXX,EXPORT-IMPORT BANK OF MALAYSIA BERHAD
FABEMY22,FABEMY22XXX,FIDELITY ASIA BANK LTD
FASEMY21,FASEMY21XXX,FA SECURITIES SDN BHD
FEEBMYK1,FEEBMYK1XXX,FIRST EAST EXPORT BANK (P.L.C)
FPMBMYK1,FPMBMYK1XXX,FULTON PREBON (MALAYSIA) SDN BERHAD
FSSBMYK1,FSSBMYK1XXX,PREMIER CAPITAL SECURITIES SDN. BHD.
FTAGMY22,FTAGMY22XXX,FTAG INVESTMENT BANK LTD.
GATIMY22,GATIMY22XXX,GAT INVESTMENT BANK LIMITED
GOSPMYK1,GOSPMYK1XXX,GOH GROUP DEVELOPMENT SDN. BHD.
GSLIMY21,GSLIMY21XXX,GOLDMAN SACHS (LABUAN) INVESTMENT BK LTD
GSMDMYK1,GSMDMYK1XXX,GOLDMAN SACHS (MALAYSIA) SDN. BHD.
GXSPMYKL,GXSPMYKLXXX,GX BANK BERHAD
HALIMY21,HALIMY21XXX,HALIM SECURITIES SDN BHD
HAOFMYK1,HAOFMYK1XXX,HA OPTIONS AND FINANCIAL FUTURES
HBMBMYKL,HBMBMYKLXXX,HSBC BANK MALAYSIA BERHAD
HDMFMYK1,HDMFMYK1XXX,HDM FUTURES SDN BHD
HDSBMY2P,HDSBMY2PXXX,AFFIN HWANG INVESTMENT BANK BERHAD
HIMRMYK1,HIMRMYK1XXX,AHAM ASSET MANAGEMENT BERHAD
HIMRMYKB,HIMRMYKBXXX,AHAM ASSET MANAGEMENT BERHAD
HIMRMYKL,HIMRMYKLXXX,AHAM ASSET MANAGEMENT BERHAD
HLANMYK1,HLANMYK1XXX,HONG LEONG ASSET MANAGEMENT BHD
HLBBMYKL,HLBBMYKLXXX,HONG LEONG BANK BERHAD
HLBLMY22,HLBLMY22XXX,"HONG LEONG BANK BERHAD, LABUAN INTERNATIONAL BRANCH"
HLGFMYK1,HLGFMYK1XXX,HLG FUTURES SDN BHD
HLIBMYKL,HLIBMYKLXXX,HONG LEONG ISLAMIC BANK BERHAD
HLIVMYKL,HLIVMYKLXXX,HONG LEONG INVESTMENT BANK BERHAD
HMABMYKL,HMABMYKLXXX,HSBC AMANAH MALAYSIA BERHAD
HSBCMYKA,HSBCMYKAXXX,THE HONGKONG AND SHANGHAI BANKING CORPORATION LIMITED
HSTMMYKL,HSTMMYKLGWS,HSBC (MALAYSIA) TRUSTEE BERHAD
HSTMMYKL,HSTMMYKLXXX,HSBC (MALAYSIA) TRUSTEE BERHAD
HUTMMYK1,HUTMMYK1XXX,HONG LEONG ASSET MANAGEMENT BHD
ICBCMY2L,ICBCMY2LXXX,"MEGA INTERNATIONAL COMMERCIAL BANK CO., LTD. LABUAN BRANCH"
ICBKMYKL,ICBKMYKLLAB,INDUSTRIAL AND COMMERCIAL BANK OF CHINA (MALAYSIA) BERHAD.
ICBKMYKL,ICBKMYKLXXX,INDUSTRIAL AND COMMERCIAL BANK OF CHINA (MALAYSIA) BERHAD.
IILMMYK1,IILMMYK1XXX,INTERNATIONAL ISLAMIC LIQUIDITY MANAGEMENT CORPORATION
INGBMYK1,INGBMYK1XXX,ING CORPORATE ADVISORY (MALAYSIA) SDN. BHD.
INNOMY41,INNOMY41XXX,UOB KAY HIAN SECURITIES (M) SDN BHD
INSSMYK1,INSSMYK1XXX,INTER-PACIFIC SECURITIES SDN. BHD.
ISCAMYK1,ISCAMYK1XXX,ABRAR DISCOUNTS BERHAD
JACLMYK1,JACLMYK1XXX,HSBC RESEARCH (MALAYSIA) SDN BHD
JFAFMY21,JFAFMY21XXX,JF APEX SECURITIES BERHAD
JFAPMYK1,JFAPMYK1XXX,JF APEX SECURITIES BERHAD
JUPSMYK1,JUPSMYK1XXX,CGS INTERNATIONAL SECURITIES MALAYSIA SDN. BHD.
KAAPMYK1,KAAPMYK1XXX,KAF ASTLEY AND PEARCE SDN BHD
KAFBMY21,KAFBMY21XXX,KAF INVESTMENT BANK BERHAD
KAFBMYK2,KAFBMYK2XXX,KAF INVESTMENT BANK BERHAD
KAFBMYKL,KAFBMYKLXXX,KAF INVESTMENT BANK BERHAD
KAFDMYK1,KAFDMYK1XXX,KAF INVESTMENT BANK BERHAD
KCPMMYK1,KCPMMYK1XXX,KOPERASI CO-OPBANK PERTAMA MALAYSIA BERHAD
KDMGMYK1,KDMGMYK1XXX,KENANGA FUTURES SDN. BHD.
KFHOMYKL,KFHOMYKLXXX,KUWAIT FINANCE HOUSE (MALAYSIA) BERHAD
KHAZMYKL,KHAZMYKLXXX,KHAZANAH NASIONAL BERHAD
KIMAMY21,KIMAMY21XXX,PAN MALAYSIA EQUITIES SDN. BHD.
KKENMY21,KKENMY21XXX,KENANGA INVESTMENT BANK BERHAD- SPI
KKENMYK1,KKENMYK1XXX,KENANGA INVESTMENT BANK BERHAD
KLANMY21,KLANMY21XXX,AMSTEEL EQUITY CAPITAL SDN. BHD.
KLMFMYK1,KLMFMYK1XXX,PUBLIC MUTUAL BERHAD
KUTMMY21,KUTMMY21XXX,AMANAH SAHAM KEDAH BERHAD
KWAPMYK1,KWAPMYK1XXX,KUMPULAN WANG PERSARAAN (DIPERBADANKAN)
KWSPMYK1,KWSPMYK1XXX,EMPLOYEES PROVIDENT FUND BOARD
LABNMY21,LABNMY21XXX,CIMB SI SDN. BHD.
LCMSMYK1,LCMSMYK1XXX,LIBRA CAPITAL MANAGEMENT SDN BHD
LEKEMY21,LEKEMY21XXX,TA SECURITIES HOLDINGS BERHAD
LOFFMYK1,LOFFMYK1XXX,LIBRA OPTIONS AND FINANCIAL FUTURES
MACQMYK1,MACQMYK1XXX,MACQUARIE (MALAYSIA) SDN BHD
MAIDMYK1,MAIDMYK1XXX,MALAYSIAN INDUSTRIAL DEVELOPMENT FI NANCE BERHAD
MAMDMY21,MAMDMY21XXX,MAYBANK ASSET MANAGEMENT SDN BHD
MAMDMYK1,MAMDMYK1XXX,MAYBANK ASSET MANAGEMENT SDN BHD
MAYDMYK1,MAYDMYK1XXX,MAYBANK INVESTMENT BANK BERHAD
MAYSMYK1,MAYSMYK1XXX,MAYBAN SECURITIES SDN BHD
MBBEMY2L,MBBEMY2LXXX,MAYBANK INTERNATIONAL LABUAN BRANCH
MBBEMYKA,MBBEMYKAXXX,MAYBANK INTERNATIONAL (L) LTD
MBBEMYKL,MBBEMYKLBAN,MALAYAN BANKING BERHAD (MAYBANK)
MBBEMYKL,MBBEMYKLBBG,MALAYAN BANKING BERHAD (MAYBANK)
MBBEMYKL,MBBEMYKLBWC,MALAYAN BANKING BERHAD (MAYBANK)
MBBEMYKL,MBBEMYKLCSD,MALAYAN BANKING BERHAD (MAYBANK)
MBBEMYKL,MBBEMYKLIPH,MALAYAN BANKING BERHAD (MAYBANK)
MBBEMYKL,MBBEMYKLJOB,MALAYAN BANKING BERHAD (MAYBANK)
MBBEMYKL,MBBEMYKLKEP,MALAYAN BANKING BERHAD (MAYBANK)
MBBEMYKL,MBBEMYKLKIN,MALAYAN BANKING BERHAD (MAYBANK)
MBBEMYKL,MBBEMYKLKLC,MALAYAN BANKING BERHAD (MAYBANK)
MBBEMYKL,MBBEMYKLMAL,MALAYAN BANKING BERHAD (MAYBANK)
MBBEMYKL,MBBEMYKLPEN,MALAYAN BANKING BERHAD (MAYBANK)
MBBEMYKL,MBBEMYKLPGC,MALAYAN BANKING BERHAD (MAYBANK)
MBBEMYKL,MBBEMYKLPJC,MALAYAN BANKING BERHAD (MAYBANK)
MBBEMYKL,MBBEMYKLPJY,MALAYAN BANKING BERHAD (MAYBANK)
MBBEMYKL,MBBEMYKLPKG,MALAYAN BANKING BERHAD (MAYBANK)
MBBEMYKL,MBBEMYKLPSG,MALAYAN BANKING BERHAD (MAYBANK)
MBBEMYKL,MBBEMYKLPUD,MALAYAN BANKING BERHAD (MAYBANK)
MBBEMYKL,MBBEMYKLPWM,MALAYAN BANKING BERHAD (MAYBANK)
MBBEMYKL,MBBEMYKLSAC,MALAYAN BANKING BERHAD (MAYBANK)
MBBEMYKL,MBBEMYKLSBN,MALAYAN BANKING BERHAD (MAYBANK)
MBBEMYKL,MBBEMYKLSHA,MALAYAN BANKING BERHAD (MAYBANK)
MBBEMYKL,MBBEMYKLSUB,MALAYAN BANKING BERHAD (MAYBANK)
MBBEMYKL,MBBEMYKLWEB,MALAYAN BANKING BERHAD (MAYBANK)
MBBEMYKL,MBBEMYKLWSD,MALAYAN BANKING BERHAD (MAYBANK)
MBBEMYKL,MBBEMYKLXXX,MALAYAN BANKING BERHAD (MAYBANK)
MBBEMYKL,MBBEMYKLYSL,MALAYAN BANKING BERHAD (MAYBANK)
MBEAMY21,MBEAMY21XXX,MAYBANK INVESTMENT BANK BERHAD - SPI
MBEAMYKL,MBEAMYKLXXX,MAYBANK INVESTMENT BANK BERHAD
MBFFMYK1,MBFFMYK1XXX,AMBANK (M) BERHAD
MBFSMY21,MBFSMY21XXX,AVENUE KESTREL SDN. BHD.
MBFUMYK1,MBFUMYK1XXX,MBF UNIT TRUST MANAGEMENT BERHAD
MBISMYKL,MBISMYKLXXX,MAYBANK ISLAMIC BERHAD
MBSDMYKM,MBSDMYKMXXX,MOBILITYONE SDN. BHD.
MCDSMYK1,MCDSMYK1XXX,BURSA MALAYSIA DEPOSITORY SDN BHD
MEIBMYKA,MEIBMYKAXXX,MIDDLE EAST INVESTMENT BANK LTD
MENPMY21,MENPMY21XXX,MERCER INVESTMENTS V PRIVATE LTD.
MEPSMYK1,MEPSMYK1XXX,MALAYSIAN ELECTRONIC PAYMENT SYSTEM SDN BHD
MERYMY21,MERYMY21XXX,MERCURY SECURITIES SDN BHD
MFBBMYKL,MFBBMYKLXXX,ALLIANCE BANK MALAYSIA BERHAD
MFINMYK1,MFINMYK1XXX,MAYBAN FINANCE BERHAD
MHCBMY2L,MHCBMY2LXXX,"MIZUHO BANK, LTD., LABUAN BRANCH"
MHCBMYK2,MHCBMYK2XXX,MIZUHO BANK (MALAYSIA) BERHAD
MHCBMYKA,MHCBMYKAXXX,MIZUHO BANK (MALAYSIA) BERHAD
MIDFMY21,MIDFMY21XXX,MIDF AMANAH INVESTMENT BANK BHD SPI
MIDFMYK1,MIDFMYK1XXX,MIDF AMANAH INVESTMENT BANK BERHAD
MIMBMYK1,MIMBMYK1XXX,HONG LEONG INVESTMENT BANK BERHAD
MLLAMY21,MLLAMY21XXX,MALACCA SECURITIES SDN BHD
MMSBMYK1,MMSBMYK1XXX,MAXMONEY SDN. BHD.
MOFDMY2L,MOFDMY2LXXX,MONFI DIGITAL BANK LTD.
MPUTMYK1,MPUTMYK1XXX,KAF INVESTMENT FUNDS BERHAD
MSMEMY21,MSMEMY21XXX,SMALL MEDIUM ENTERPRISE DEVELOPMENT BANK MALAYSIA BERHAD
MSMEMYK1,MSMEMYK1XXX,SMALL MEDIUM ENTERPRISE DEVELOPMENT BANK MALAYSIA BERHAD
MSSHMY21,MSSHMY21XXX,MERCHANTRADE ASIA SDN BHD
NBADMYKL,NBADMYKLLAU,FIRST ABU DHABI BANK PJSC
NBADMYKL,NBADMYKLXXX,FIRST ABU DHABI BANK PJSC
NMRSMYK1,NMRSMYK1XXX,NOMURA SECURITIES MALAYSIA SDN BHD
NMSBMYK1,NMSBMYK1XXX,NOMURA (MALAYSIA) SDN BHD
NOCMMYKL,NOCMMYKLXXX,NOMURA ASSET MANAGEMENT MALAYSIA SDN BHD
NOSBMY21,NOSBMY21XXX,NOVATEL SDN. BHD.
OABBMYKL,OABBMYKLXXX,OCBC AL-AMIN BANK BERHAD
OCBCMYKA,OCBCMYKAXXX,"OVERSEA-CHINESE BANKING CORPORATION LIMITED, LABUAN BRANCH"
OCBCMYKL,OCBCMYKLXXX,OCBC BANK ( MALAYSIA ) BERHAD
ORMSMYK1,ORMSMYK1XXX,ONG RESEARCH (MALAYSIA) SDN BHD
OSKFMYK1,OSKFMYK1XXX,O.S.K. FUTURES AND OPTIONS SDN. BHD
OSKIMYKL,OSKIMYKLXXX,RHB INVESTMENT BANK BERHAD
OSPSMYK1,OSPSMYK1XXX,OSK AND PARTNERS SDN. BHD.
OSSBMYK1,OSSBMYK1XXX,RHB INVESTMENT BANK BERHAD
PBBEMYKL,PBBEMYKLXXX,PUBLIC BANK BERHAD
PBLLMYKA,PBLLMYKAXXX,PUBLIC BANK (L) LTD
PBSNMYK1,PBSNMYK1XXX,PERMODALAN BSN BERHAD
PCBCMY22,PCBCMY22XXX,CHINA CONSTRUCTION BANK CORPORATION LABUAN BRANCH
PCBCMYKL,PCBCMYKLXXX,CHINA CONSTRUCTION BANK (MALAYSIA) BERHAD
PCOSMYK1,PCOSMYK1XXX,PICA (M) CORPORATION SDN BHD
PCTRMYK2,PCTRMYK2XXX,PACIFIC TRUSTEES BERHAD
PEJFMYK1,PEJFMYK1XXX,JPMORGAN SECURITIES (MALAYSIA) SDN. BHD.
PEMBMY21,PEMBMY21XXX,BANK PEMBANGUNAN MALAYSIA BERHAD
PEMBMYK1,PEMBMYK1XXX,BANK PEMBANGUNAN MALAYSIA BERHAD
PENSMYK1,PENSMYK1XXX,PM SECURITIES SDN BHD MUI PLAZA GROUND FLOOR
PERDMYK1,PERDMYK1XXX,HONG LEONG INVESTMENT BANK BERHAD
PERMMY21,PERMMY21XXX,PERMODALAN NASIONAL BERHAD
PERMMYK1,PERMMYK1XXX,PERMODALAN NASIONAL BERHAD
PERMMYKB,PERMMYKBXXX,PERMODALAN NASIONAL BERHAD
PERMMYKG,PERMMYKGXXX,PERMODALAN NASIONAL BERHAD
PERMMYKK,PERMMYKKXXX,PERMODALAN NASIONAL BERHAD
PERMMYKP,PERMMYKPXXX,PERMODALAN NASIONAL BERHAD
PFBEMYK1,PFBEMYK1XXX,PBFIN BERHAD
PHBMMYKL,PHBMMYKLXXX,AFFIN BANK BERHAD
PHCHMY22,PHCHMY22XXX,PHILLIP CAPITAL SDN BHD
PIBEMYK1,PIBEMYK1XXX,PUBLIC ISLAMIC BANK BERHAD
PJBJMY21,PJBJMY21XXX,PELABURAN JOHOR BERHAD
PKUMMY21,PKUMMY21XXX,PENGURUSAN KUMIPA BERHAD
PMBBMYK1,PMBBMYK1XXX,AFFIN HWANG INVESTMENT BANK BERHAD
PMFBMY21,PMFBMY21XXX,BOS WEALTH MANAGEMENT MALAYSIA BERHAD
POFFMYK1,POFFMYK1XXX,PHILEO ALLIED OPTION AND FINANCIAL FUTURES SDN. BHD.
PPSSMYK1,PPSSMYK1XXX,MAYBANK INVESTMENT BANK BERHAD
PTBBMYK1,PTBBMYK1XXX,M AND A SECURITIES SDN. BHD.
PUIBMYKL,PUIBMYKLXXX,PUBLIC ISLAMIC BANK BERHAD
PUTBMY21,PUTBMY21XXX,PTB UNIT TRUST BERHAD
RHBAMYKL,RHBAMYKLXXX,RHB ISLAMIC BANK BERHAD
RHBBMYKA,RHBBMYKAXXX,RHB BANK (L) LTD
RHBBMYKL,RHBBMYKLXXX,RHB BANK BERHAD
RHBFMYK1,RHBFMYK1XXX,RHB INVESTMENT BANK BERHAD
RHBKMYK1,RHBKMYK1XXX,RASHID HUSSAIN SECURITIES SDN BHD
RHBMMYK1,RHBMMYK1XXX,RHB INVESTMENT BANK BERHAD
RHBTMYKL,RHBTMYKLXXX,RHB ASSET MANAGEMENT SDN BHD
RINTMY22,RINTMY22XXX,CREDIT INVESTMENT BANK LTD.
RJHIMYKL,RJHIMYKLXXX,AL RAJHI BANKING AND INVESTMENT CORPORATION (MALAYSIA) BHD
RNZDMYK1,RNZDMYK1XXX,RASHID AND ZAKI DERIVATIVES SDN BHD
SASBMY41,SASBMY41XXX,SAHAM SABAH BERHAD
SASHMYK1,SASHMYK1XXX,SAMSUNG C AND T KL SDN BHD
SBUTMYK1,SBUTMYK1XXX,SBB UNIT TRUST MANAGEMENT B ERHAD
SCBLMYKX,SCBLMYKXLAB,STANDARD CHARTERED BANK MALAYSIA BERHAD
SCBLMYKX,SCBLMYKXWMO,STANDARD CHARTERED BANK MALAYSIA BERHAD
SCBLMYKX,SCBLMYKXXXX,STANDARD CHARTERED BANK MALAYSIA BERHAD
SCCHMYKL,SCCHMYKLXXX,YTL DIGITAL BANK BERHAD
SCNTMYK1,SCNTMYK1XXX,SAMSUNG C AND T MALAYSIA SDN BHD
SCSRMYK1,SCSRMYK1XXX,STANDARD CHARTERED SAADIQ BERHAD
SCSRMYKK,SCSRMYKKXXX,STANDARD CHARTERED SAADIQ BERHAD
SDBEMY41,SDBEMY41XXX,SABAH DEVELOPMENT BANK BERHAD
SDEPMYK1,SDEPMYK1XXX,AMANAH SHORT DEPOSITS BERHAD
SEACMYK1,SEACMYK1KSC,KAF-SEAGROATT AND CAMPBELL SECURITIES SDN. BHD.
SEACMYK1,SEACMYK1XXX,KAF-SEAGROATT AND CAMPBELL SECURITIES SDN. BHD.
SECSMYK1,SECSMYK1XXX,PUBLIC INVESTMENT BANK BERHAD
SESBMY21,SESBMY21XXX,WK SECURITIES SDN BHD
SETAMYK1,SETAMYK1XXX,TA CENTRE BERHAD
SIMVMY2L,SIMVMY2LXXX,SINGPOLI INVESTMENT BANK LIMITED
SJSEMY21,SJSEMY21XXX,SJ SECURITIES SDN BHD
SMBBMYK1,SMBBMYK1001,PUBLIC INVESTMENT BANK BERHAD
SMBBMYK1,SMBBMYK1002,PUBLIC INVESTMENT BANK BERHAD
SMBBMYK1,SMBBMYK1XXX,PUBLIC INVESTMENT BANK BERHAD
SMBCMY22,SMBCMY22XXX,SUMITOMO MITSUI BANKING CORPORATION MALAYSIA BERHAD
SMBCMYKA,SMBCMYKAXXX,SUMITOMO MITSUI BANKING CORPORATION
SMBCMYKL,SMBCMYKLXXX,SUMITOMO MITSUI BANKING CORPORATION MALAYSIA BERHAD
SMBLMYK1,SMBLMYK1XXX,SCHRODERS MALAYSIA (L) BERHAD
SSFOMYK1,SSFOMYK1XXX,SARAWAK SECURITIES FUTURES SDN BHD
SSSDMY21,SSSDMY21XXX,MALPAC MANAGEMENT SDN. BHD.
SSSHMYK1,SSSHMYK1XXX,RC HOLDINGS SDN. BHD.
SSTDMY21,SSTDMY21XXX,KENANGA INVESTMENT BANK BERHAD
SSWKMYK1,SSWKMYK1XXX,AMANAH SAHAM SARAWAK BERHAD
TAFRMYK1,TAFRMYK1XXX,TA FUTURES SDN BHD
TAUTMYK1,TAUTMYK1XXX,TA UNIT TRUST MANAGEMENT BERHAD
TCBBMY22,TCBBMY22XXX,"TAICHUNG COMMERCIAL BANK CO.,LTD LABUAN BRANCH"
THKHMYP1,THKHMYP1XXX,THONG-KHJC SDN BHD
TKHOMY21,TKHOMY21XXX,THONG AND KAY HIAN SECURITIES SDN BHD
TRLOMYKL,TRLOMYKLXXX,TRANGLO SDN BHD
TRTDMY22,TRTDMY22XXX,TML REMITTANCE CENTER SDN. BHD.
TRWIMYK1,TRWIMYK1XXX,TRANSFERWISE MALAYSIA SDN. BHD.
TSIBMY22,TSIBMY22XXX,"TAISHIN INTERNATIONAL BANK CO.,LTD. LABUAN BRANCH"
UBBIMY22,UBBIMY22XXX,UBB INVESTMENT BANK LIMITED
UOBSMYK1,UOBSMYK1XXX,UOB SECURITIES PTE LTD
UOVBMY21,UOVBMY21XXX,UNITED OVERSEAS BANK (MALAYSIA) BHD
UOVBMY2L,UOVBMY2LXXX,UNITED OVERSEAS BANK LIMITED
UOVBMYK1,UOVBMYK101J,UNITED OVERSEAS BANK (MALAYSIA) BHD
UOVBMYK1,UOVBMYK101K,UNITED OVERSEAS BANK (MALAYSIA) BHD
UOVBMYK1,UOVBMYK101P,UNITED OVERSEAS BANK (MALAYSIA) BHD
UOVBMYK1,UOVBMYK101T,UNITED OVERSEAS BANK (MALAYSIA) BHD
UOVBMYK1,UOVBMYK1022,UNITED OVERSEAS BANK (MALAYSIA) BHD
UOVBMYK1,UOVBMYK1023,UNITED OVERSEAS BANK (MALAYSIA) BHD
UOVBMYK1,UOVBMYK1024,UNITED OVERSEAS BANK (MALAYSIA) BHD
UOVBMYK1,UOVBMYK1025,UNITED OVERSEAS BANK (MALAYSIA) BHD
UOVBMYK1,UOVBMYK1026,UNITED OVERSEAS BANK (MALAYSIA) BHD
UOVBMYK1,UOVBMYK1027,UNITED OVERSEAS BANK (MALAYSIA) BHD
UOVBMYK1,UOVBMYK102H,UNITED OVERSEAS BANK (MALAYSIA) BHD
UOVBMYK1,UOVBMYK102J,UNITED OVERSEAS BANK (MALAYSIA) BHD
UOVBMYK1,UOVBMYK102K,UNITED OVERSEAS BANK (MALAYSIA) BHD
UOVBMYK1,UOVBMYK102P,UNITED OVERSEAS BANK (MALAYSIA) BHD
UOVBMYK1,UOVBMYK102T,UNITED OVERSEAS BANK (MALAYSIA) BHD
UOVBMYK1,UOVBMYK103J,UNITED OVERSEAS BANK (MALAYSIA) BHD
UOVBMYK1,UOVBMYK103K,UNITED OVERSEAS BANK (MALAYSIA) BHD
UOVBMYK1,UOVBMYK103P,UNITED OVERSEAS BANK (MALAYSIA) BHD
UOVBMYK1,UOVBMYK103T,UNITED OVERSEAS BANK (MALAYSIA) BHD
UOVBMYK1,UOVBMYK1042,UNITED OVERSEAS BANK (MALAYSIA) BHD
UOVBMYK1,UOVBMYK1043,UNITED OVERSEAS BANK (MALAYSIA) BHD
UOVBMYK1,UOVBMYK104K,UNITED OVERSEAS BANK (MALAYSIA) BHD
UOVBMYK1,UOVBMYK10K1,UNITED OVERSEAS BANK (MALAYSIA) BHD
UOVBMYK1,UOVBMYK10K2,UNITED OVERSEAS BANK (MALAYSIA) BHD
UOVBMYK1,UOVBMYK10K3,UNITED OVERSEAS BANK (MALAYSIA) BHD
UOVBMYK1,UOVBMYK1XXX,UNITED OVERSEAS BANK (MALAYSIA) BHD
UOVBMYKL,UOVBMYKLCMS,UNITED OVERSEAS BANK (MALAYSIA) BHD
UOVBMYKL,UOVBMYKLCND,UNITED OVERSEAS BANK (MALAYSIA) BHD
UOVBMYKL,UOVBMYKLXXX,UNITED OVERSEAS BANK (MALAYSIA) BHD
USMSMYK1,USMSMYK1XXX,"UBS SECURITIES MALAYSIA SDN BHD. WISMA HONG LEONG, FLOOR 7"
VIBRMYK1,VIBRMYK1XXX,PRIORITY CARE SDN. BHD.
VOGMMYK1,VOGMMYK1XXX,VOLKSWAGEN GROUP MALAYSIA
WAAFMY2L,WAAFMY2LXXX,WAAFI BANK LTD.
WKOFMY21,WKOFMY21XXX,WK OPTIONS AND FUTURES SDN BHD
XKLSMYK1,XKLSMYK1XXX,BURSA MALAYSIA BERHAD
XLOFMYK1,XLOFMYK1XXX,BURSA MALAYSIA DERIVATIVES BERHAD
YEINMY22,YEINMY22XXX,YES INVESTMENT BANK LTD.
